No.     Time           Source                Destination           Protocol Info
      1 0.000000       172.17.32.142         42.62.69.169          TCP      50075 → https(443) [SYN] Seq=0 Win=65535 Len=0 MSS=1460 WS=32 TSval=502917721 TSecr=0 SACK_PERM=1
      2 0.049757       42.62.69.169          172.17.32.142         TCP      https(443) → 50075 [SYN, ACK] Seq=0 Ack=1 Win=5792 Len=0 MSS=1460 SACK_PERM=1 TSval=3425042676 TSecr=502917721 WS=512
      3 0.049955       172.17.32.142         42.62.69.169          TCP      50075 → https(443) [ACK] Seq=1 Ack=1 Win=131744 Len=0 TSval=502917770 TSecr=3425042676
      4 0.052656       172.17.32.142         42.62.69.169          TLSv1.2  Client Hello
      5 0.121172       42.62.69.169          172.17.32.142         TCP      https(443) → 50075 [ACK] Seq=1 Ack=176 Win=7168 Len=0 TSval=3425042729 TSecr=502917772
      6 0.121178       42.62.69.169          172.17.32.142         TLSv1.2  Server Hello
      7 0.121179       42.62.69.169          172.17.32.142         TCP      [TCP segment of a reassembled PDU]
      8 0.121180       42.62.69.169          172.17.32.142         TLSv1.2  Certificate[TCP segment of a reassembled PDU]
      9 0.121181       42.62.69.169          172.17.32.142         TLSv1.2  Certificate Status, Server Key Exchange, Server Hello Done
     10 0.121261       172.17.32.142         42.62.69.169          TCP      50075 → https(443) [ACK] Seq=176 Ack=2897 Win=128864 Len=0 TSval=502917840 TSecr=3425042731
     11 0.121262       172.17.32.142         42.62.69.169          TCP      50075 → https(443) [ACK] Seq=176 Ack=4913 Win=126848 Len=0 TSval=502917840 TSecr=3425042731
     12 0.121305       172.17.32.142         42.62.69.169          TCP      [TCP Window Update] 50075 → https(443) [ACK] Seq=176 Ack=4913 Win=131072 Len=0 TSval=502917840 TSecr=3425042731
     13 0.298385       172.17.32.142         42.62.69.169          TLSv1.2  Client Key Exchange, Change Cipher Spec, Hello Request, Hello Request
     14 0.350160       42.62.69.169          172.17.32.142         TLSv1.2  Change Cipher Spec, Encrypted Handshake Message
     15 0.350223       172.17.32.142         42.62.69.169          TLSv1.2  Application Data
     16 0.402028       42.62.69.169          172.17.32.142         TLSv1.2  Application Data
     17 0.402040       42.62.69.169          172.17.32.142         TLSv1.2  Encrypted Alert
     18 0.402210       172.17.32.142         42.62.69.169          TCP      50075 → https(443) [ACK] Seq=482 Ack=5917 Win=130112 Len=0 TSval=502918118 TSecr=3425043026
     19 0.402214       172.17.32.142         42.62.69.169          TCP      50075 → https(443) [ACK] Seq=482 Ack=5949 Win=130080 Len=0 TSval=502918118 TSecr=3425043026
     20 0.407974       172.17.32.142         42.62.69.169          TCP      50075 → https(443) [FIN, ACK] Seq=482 Ack=5949 Win=131072 Len=0 TSval=502918123 TSecr=3425043026
     21 0.412593       172.17.32.142         42.62.69.169          TCP      50076 → https(443) [SYN] Seq=0 Win=65535 Len=0 MSS=1460 WS=32 TSval=502918127 TSecr=0 SACK_PERM=1
     22 0.459273       42.62.69.169          172.17.32.142         TCP      https(443) → 50075 [ACK] Seq=5949 Ack=483 Win=8192 Len=0 TSval=3425043084 TSecr=502918123
     23 0.459278       42.62.69.169          172.17.32.142         TCP      https(443) → 50076 [SYN, ACK] Seq=0 Ack=1 Win=5792 Len=0 MSS=1460 SACK_PERM=1 TSval=3425043089 TSecr=502918127 WS=512
     24 0.459355       172.17.32.142         42.62.69.169          TCP      50076 → https(443) [ACK] Seq=1 Ack=1 Win=131744 Len=0 TSval=502918173 TSecr=3425043089
     25 0.461339       172.17.32.142         42.62.69.169          TLSv1.2  Client Hello
     26 0.510902       42.62.69.169          172.17.32.142         TCP      https(443) → 50076 [ACK] Seq=1 Ack=176 Win=7168 Len=0 TSval=3425043137 TSecr=502918174
     27 0.510907       42.62.69.169          172.17.32.142         TLSv1.2  Server Hello
     28 0.510908       42.62.69.169          172.17.32.142         TCP      [TCP segment of a reassembled PDU]
     29 0.511009       42.62.69.169          172.17.32.142         TLSv1.2  Certificate[TCP segment of a reassembled PDU]
     30 0.511011       42.62.69.169          172.17.32.142         TLSv1.2  Certificate Status, Server Key Exchange, Server Hello Done
     31 0.511020       172.17.32.142         42.62.69.169          TCP      50076 → https(443) [ACK] Seq=176 Ack=2897 Win=128864 Len=0 TSval=502918223 TSecr=3425043138
     32 0.511100       172.17.32.142         42.62.69.169          TCP      50076 → https(443) [ACK] Seq=176 Ack=4913 Win=129056 Len=0 TSval=502918223 TSecr=3425043138
     33 0.559701       172.17.32.142         42.62.69.169          TLSv1.2  Client Key Exchange, Change Cipher Spec, Hello Request, Hello Request
     34 0.609319       42.62.69.169          172.17.32.142         TLSv1.2  Change Cipher Spec, Encrypted Handshake Message
     35 0.609472       172.17.32.142         42.62.69.169          TLSv1.2  Application Data
     36 0.657854       42.62.69.169          172.17.32.142         TLSv1.2  Application Data
     37 0.657859       42.62.69.169          172.17.32.142         TLSv1.2  Encrypted Alert
     38 0.657923       172.17.32.142         42.62.69.169          TCP      50076 → https(443) [ACK] Seq=482 Ack=5917 Win=130112 Len=0 TSval=502918368 TSecr=3425043286
     39 0.657924       172.17.32.142         42.62.69.169          TCP      50076 → https(443) [ACK] Seq=482 Ack=5949 Win=130080 Len=0 TSval=502918368 TSecr=3425043286
     40 0.661869       172.17.32.142         42.62.69.169          TCP      50076 → https(443) [FIN, ACK] Seq=482 Ack=5949 Win=131072 Len=0 TSval=502918371 TSecr=3425043286
     41 0.710099       42.62.69.169          172.17.32.142         TCP      https(443) → 50076 [ACK] Seq=5949 Ack=483 Win=8192 Len=0 TSval=3425043339 TSecr=502918371
     42 0.725936       172.17.32.142         42.62.69.169          TCP      50077 → https(443) [SYN] Seq=0 Win=65535 Len=0 MSS=1460 WS=32 TSval=502918433 TSecr=0 SACK_PERM=1
     43 0.774302       42.62.69.169          172.17.32.142         TCP      https(443) → 50077 [SYN, ACK] Seq=0 Ack=1 Win=5792 Len=0 MSS=1460 SACK_PERM=1 TSval=3425043403 TSecr=502918433 WS=512
     44 0.774380       172.17.32.142         42.62.69.169          TCP      50077 → https(443) [ACK] Seq=1 Ack=1 Win=131744 Len=0 TSval=502918481 TSecr=3425043403
     45 0.786804       172.17.32.142         42.62.69.169          TLSv1.2  Client Hello
     46 0.834990       42.62.69.169          172.17.32.142         TCP      https(443) → 50077 [ACK] Seq=1 Ack=176 Win=7168 Len=0 TSval=3425043463 TSecr=502918493
     47 0.834995       42.62.69.169          172.17.32.142         TLSv1.2  Server Hello
     48 0.834996       42.62.69.169          172.17.32.142         TCP      [TCP segment of a reassembled PDU]
     49 0.835095       172.17.32.142         42.62.69.169          TCP      50077 → https(443) [ACK] Seq=176 Ack=2897 Win=128864 Len=0 TSval=502918540 TSecr=3425043464
     50 0.836689       42.62.69.169          172.17.32.142         TLSv1.2  Certificate[TCP segment of a reassembled PDU]
     51 0.836693       42.62.69.169          172.17.32.142         TLSv1.2  Certificate Status, Server Key Exchange, Server Hello Done
     52 0.836758       172.17.32.142         42.62.69.169          TCP      50077 → https(443) [ACK] Seq=176 Ack=4913 Win=129056 Len=0 TSval=502918541 TSecr=3425043464
     53 0.918100       172.17.32.142         42.62.69.169          TLSv1.2  Client Key Exchange, Change Cipher Spec, Hello Request, Hello Request
     54 0.967985       42.62.69.169          172.17.32.142         TLSv1.2  Change Cipher Spec, Encrypted Handshake Message
     55 0.968072       172.17.32.142         42.62.69.169          TLSv1.2  Application Data
     56 1.017943       42.62.69.169          172.17.32.142         TLSv1.2  Application Data
     57 1.017954       42.62.69.169          172.17.32.142         TLSv1.2  Encrypted Alert
     58 1.018051       172.17.32.142         42.62.69.169          TCP      50077 → https(443) [ACK] Seq=482 Ack=5917 Win=130112 Len=0 TSval=502918720 TSecr=3425043646
     59 1.018109       172.17.32.142         42.62.69.169          TCP      50077 → https(443) [ACK] Seq=482 Ack=5949 Win=130080 Len=0 TSval=502918720 TSecr=3425043646
     60 1.051116       172.17.32.142         42.62.69.169          TCP      50077 → https(443) [FIN, ACK] Seq=482 Ack=5949 Win=131072 Len=0 TSval=502918753 TSecr=3425043646
     61 1.053944       172.17.32.142         42.62.69.169          TCP      50078 → https(443) [SYN] Seq=0 Win=65535 Len=0 MSS=1460 WS=32 TSval=502918755 TSecr=0 SACK_PERM=1
     62 1.100345       42.62.69.169          172.17.32.142         TCP      https(443) → 50077 [ACK] Seq=5949 Ack=483 Win=8192 Len=0 TSval=3425043727 TSecr=502918753
     63 1.103346       42.62.69.169          172.17.32.142         TCP      https(443) → 50078 [SYN, ACK] Seq=0 Ack=1 Win=5792 Len=0 MSS=1460 SACK_PERM=1 TSval=3425043731 TSecr=502918755 WS=512
     64 1.103418       172.17.32.142         42.62.69.169          TCP      50078 → https(443) [ACK] Seq=1 Ack=1 Win=131744 Len=0 TSval=502918803 TSecr=3425043731
     65 1.105730       172.17.32.142         42.62.69.169          TLSv1.2  Client Hello
     66 1.160346       42.62.69.169          172.17.32.142         TCP      https(443) → 50078 [ACK] Seq=1 Ack=176 Win=7168 Len=0 TSval=3425043787 TSecr=502918805
     67 1.169185       42.62.69.169          172.17.32.142         TLSv1.2  Server Hello
     68 1.169190       42.62.69.169          172.17.32.142         TCP      [TCP segment of a reassembled PDU]
     69 1.169247       172.17.32.142         42.62.69.169          TCP      50078 → https(443) [ACK] Seq=176 Ack=2897 Win=128864 Len=0 TSval=502918866 TSecr=3425043788
     70 1.171819       42.62.69.169          172.17.32.142         TLSv1.2  Certificate[TCP segment of a reassembled PDU]
     71 1.171828       42.62.69.169          172.17.32.142         TLSv1.2  Certificate Status, Server Key Exchange, Server Hello Done
     72 1.171901       172.17.32.142         42.62.69.169          TCP      50078 → https(443) [ACK] Seq=176 Ack=4913 Win=129056 Len=0 TSval=502918868 TSecr=3425043788
     73 1.232000       172.17.32.142         42.62.69.169          TLSv1.2  Client Key Exchange, Change Cipher Spec, Hello Request, Hello Request
     74 1.283375       42.62.69.169          172.17.32.142         TLSv1.2  Change Cipher Spec, Encrypted Handshake Message
     75 1.283435       172.17.32.142         42.62.69.169          TLSv1.2  Application Data
     76 1.334339       42.62.69.169          172.17.32.142         TLSv1.2  Application Data
     77 1.334344       42.62.69.169          172.17.32.142         TLSv1.2  Encrypted Alert
     78 1.334411       172.17.32.142         42.62.69.169          TCP      50078 → https(443) [ACK] Seq=482 Ack=5917 Win=130112 Len=0 TSval=502919029 TSecr=3425043961
     79 1.334411       172.17.32.142         42.62.69.169          TCP      50078 → https(443) [ACK] Seq=482 Ack=5949 Win=130080 Len=0 TSval=502919029 TSecr=3425043961
     80 1.336326       172.17.32.142         42.62.69.169          TCP      50078 → https(443) [FIN, ACK] Seq=482 Ack=5949 Win=131072 Len=0 TSval=502919030 TSecr=3425043961
     81 1.338354       172.17.32.142         42.62.69.169          TCP      50079 → https(443) [SYN] Seq=0 Win=65535 Len=0 MSS=1460 WS=32 TSval=502919031 TSecr=0 SACK_PERM=1
     82 1.388337       42.62.69.169          172.17.32.142         TCP      https(443) → 50078 [ACK] Seq=5949 Ack=483 Win=8192 Len=0 TSval=3425044014 TSecr=502919030
     83 1.388341       42.62.69.169          172.17.32.142         TCP      https(443) → 50079 [SYN, ACK] Seq=0 Ack=1 Win=5792 Len=0 MSS=1460 SACK_PERM=1 TSval=3425044016 TSecr=502919031 WS=512
     84 1.388455       172.17.32.142         42.62.69.169          TCP      50079 → https(443) [ACK] Seq=1 Ack=1 Win=131744 Len=0 TSval=502919081 TSecr=3425044016
     85 1.390422       172.17.32.142         42.62.69.169          TLSv1.2  Client Hello
     86 1.441699       42.62.69.169          172.17.32.142         TCP      https(443) → 50079 [ACK] Seq=1 Ack=176 Win=7168 Len=0 TSval=3425044067 TSecr=502919083
     87 1.441703       42.62.69.169          172.17.32.142         TLSv1.2  Server Hello
     88 1.441704       42.62.69.169          172.17.32.142         TCP      [TCP segment of a reassembled PDU]
     89 1.441822       42.62.69.169          172.17.32.142         TLSv1.2  Certificate[TCP segment of a reassembled PDU]
     90 1.441827       42.62.69.169          172.17.32.142         TLSv1.2  Certificate Status, Server Key Exchange, Server Hello Done
     91 1.441839       172.17.32.142         42.62.69.169          TCP      50079 → https(443) [ACK] Seq=176 Ack=2897 Win=128864 Len=0 TSval=502919134 TSecr=3425044068
     92 1.441885       172.17.32.142         42.62.69.169          TCP      50079 → https(443) [ACK] Seq=176 Ack=4913 Win=129056 Len=0 TSval=502919134 TSecr=3425044068
     93 1.477998       172.17.32.142         42.62.69.169          TLSv1.2  Client Key Exchange, Change Cipher Spec, Hello Request, Hello Request
     94 1.531114       42.62.69.169          172.17.32.142         TLSv1.2  Change Cipher Spec, Encrypted Handshake Message
     95 1.531177       172.17.32.142         42.62.69.169          TLSv1.2  Application Data
     96 1.582117       42.62.69.169          172.17.32.142         TLSv1.2  Application Data
     97 1.582122       42.62.69.169          172.17.32.142         TLSv1.2  Encrypted Alert
     98 1.582183       172.17.32.142         42.62.69.169          TCP      50079 → https(443) [ACK] Seq=482 Ack=5917 Win=130112 Len=0 TSval=502919272 TSecr=3425044208
     99 1.582184       172.17.32.142         42.62.69.169          TCP      50079 → https(443) [ACK] Seq=482 Ack=5949 Win=130080 Len=0 TSval=502919272 TSecr=3425044208
    100 1.583853       172.17.32.142         42.62.69.169          TCP      50079 → https(443) [FIN, ACK] Seq=482 Ack=5949 Win=131072 Len=0 TSval=502919273 TSecr=3425044208
    101 1.586418       172.17.32.142         42.62.69.169          TCP      50080 → https(443) [SYN] Seq=0 Win=65535 Len=0 MSS=1460 WS=32 TSval=502919275 TSecr=0 SACK_PERM=1
    102 1.634014       42.62.69.169          172.17.32.142         TCP      https(443) → 50080 [SYN, ACK] Seq=0 Ack=1 Win=5792 Len=0 MSS=1460 SACK_PERM=1 TSval=3425044262 TSecr=502919275 WS=512
    103 1.634072       172.17.32.142         42.62.69.169          TCP      50080 → https(443) [ACK] Seq=1 Ack=1 Win=131744 Len=0 TSval=502919322 TSecr=3425044262
    104 1.636204       172.17.32.142         42.62.69.169          TLSv1.2  Client Hello
    105 1.642116       42.62.69.169          172.17.32.142         TCP      https(443) → 50079 [ACK] Seq=5949 Ack=483 Win=8192 Len=0 TSval=3425044261 TSecr=502919273
    106 1.685501       42.62.69.169          172.17.32.142         TCP      https(443) → 50080 [ACK] Seq=1 Ack=176 Win=7168 Len=0 TSval=3425044312 TSecr=502919324
    107 1.685505       42.62.69.169          172.17.32.142         TLSv1.2  Server Hello
    108 1.685506       42.62.69.169          172.17.32.142         TCP      [TCP segment of a reassembled PDU]
    109 1.685507       42.62.69.169          172.17.32.142         TLSv1.2  Certificate[TCP segment of a reassembled PDU]
    110 1.685508       42.62.69.169          172.17.32.142         TLSv1.2  Certificate Status, Server Key Exchange, Server Hello Done
    111 1.685579       172.17.32.142         42.62.69.169          TCP      50080 → https(443) [ACK] Seq=176 Ack=2897 Win=128864 Len=0 TSval=502919371 TSecr=3425044313
    112 1.685580       172.17.32.142         42.62.69.169          TCP      50080 → https(443) [ACK] Seq=176 Ack=4913 Win=126848 Len=0 TSval=502919371 TSecr=3425044313
    113 1.685622       172.17.32.142         42.62.69.169          TCP      [TCP Window Update] 50080 → https(443) [ACK] Seq=176 Ack=4913 Win=131072 Len=0 TSval=502919371 TSecr=3425044313
    114 1.718540       172.17.32.142         42.62.69.169          TLSv1.2  Client Key Exchange, Change Cipher Spec, Hello Request, Hello Request
    115 1.767159       42.62.69.169          172.17.32.142         TLSv1.2  Change Cipher Spec, Encrypted Handshake Message
    116 1.767217       172.17.32.142         42.62.69.169          TLSv1.2  Application Data
    117 1.818807       42.62.69.169          172.17.32.142         TLSv1.2  Application Data
    118 1.818815       42.62.69.169          172.17.32.142         TLSv1.2  Encrypted Alert
    119 1.818962       172.17.32.142         42.62.69.169          TCP      50080 → https(443) [ACK] Seq=482 Ack=5917 Win=130112 Len=0 TSval=502919501 TSecr=3425044444
    120 1.818964       172.17.32.142         42.62.69.169          TCP      50080 → https(443) [ACK] Seq=482 Ack=5949 Win=130080 Len=0 TSval=502919501 TSecr=3425044444
    121 1.823858       172.17.32.142         42.62.69.169          TCP      50080 → https(443) [FIN, ACK] Seq=482 Ack=5949 Win=131072 Len=0 TSval=502919505 TSecr=3425044444
    122 1.826151       172.17.32.142         42.62.69.169          TCP      50081 → https(443) [SYN] Seq=0 Win=65535 Len=0 MSS=1460 WS=32 TSval=502919507 TSecr=0 SACK_PERM=1
    123 1.876059       42.62.69.169          172.17.32.142         TCP      https(443) → 50080 [ACK] Seq=5949 Ack=483 Win=8192 Len=0 TSval=3425044502 TSecr=502919505
    124 1.876063       42.62.69.169          172.17.32.142         TCP      https(443) → 50081 [SYN, ACK] Seq=0 Ack=1 Win=5792 Len=0 MSS=1460 SACK_PERM=1 TSval=3425044503 TSecr=502919507 WS=512
    125 1.876158       172.17.32.142         42.62.69.169          TCP      50081 → https(443) [ACK] Seq=1 Ack=1 Win=131744 Len=0 TSval=502919557 TSecr=3425044503
    126 1.878230       172.17.32.142         42.62.69.169          TLSv1.2  Client Hello
    127 1.926104       42.62.69.169          172.17.32.142         TCP      https(443) → 50081 [ACK] Seq=1 Ack=176 Win=7168 Len=0 TSval=3425044553 TSecr=502919559
    128 1.927470       42.62.69.169          172.17.32.142         TLSv1.2  Server Hello
    129 1.927481       42.62.69.169          172.17.32.142         TCP      [TCP segment of a reassembled PDU]
    130 1.927487       42.62.69.169          172.17.32.142         TLSv1.2  Certificate[TCP segment of a reassembled PDU]
    131 1.927490       42.62.69.169          172.17.32.142         TLSv1.2  Certificate Status, Server Key Exchange, Server Hello Done
    132 1.927656       172.17.32.142         42.62.69.169          TCP      50081 → https(443) [ACK] Seq=176 Ack=2897 Win=128864 Len=0 TSval=502919606 TSecr=3425044554
    133 1.927658       172.17.32.142         42.62.69.169          TCP      50081 → https(443) [ACK] Seq=176 Ack=4913 Win=126848 Len=0 TSval=502919606 TSecr=3425044554
    134 1.927760       172.17.32.142         42.62.69.169          TCP      [TCP Window Update] 50081 → https(443) [ACK] Seq=176 Ack=4913 Win=131072 Len=0 TSval=502919606 TSecr=3425044554
    135 1.960809       172.17.32.142         42.62.69.169          TLSv1.2  Client Key Exchange, Change Cipher Spec, Hello Request, Hello Request
    136 2.009169       42.62.69.169          172.17.32.142         TLSv1.2  Change Cipher Spec, Encrypted Handshake Message
    137 2.009225       172.17.32.142         42.62.69.169          TLSv1.2  Application Data
    138 2.058392       42.62.69.169          172.17.32.142         TLSv1.2  Application Data
    139 2.058397       42.62.69.169          172.17.32.142         TLSv1.2  Encrypted Alert
    140 2.058475       172.17.32.142         42.62.69.169          TCP      50081 → https(443) [ACK] Seq=482 Ack=5917 Win=130112 Len=0 TSval=502919736 TSecr=3425044684
    141 2.058476       172.17.32.142         42.62.69.169          TCP      50081 → https(443) [ACK] Seq=482 Ack=5949 Win=130080 Len=0 TSval=502919736 TSecr=3425044684
    142 2.060384       172.17.32.142         42.62.69.169          TCP      50081 → https(443) [FIN, ACK] Seq=482 Ack=5949 Win=131072 Len=0 TSval=502919737 TSecr=3425044684
    143 2.079497       172.17.32.142         42.62.69.169          TCP      50082 → https(443) [SYN] Seq=0 Win=65535 Len=0 MSS=1460 WS=32 TSval=502919756 TSecr=0 SACK_PERM=1
    144 2.112901       42.62.69.169          172.17.32.142         TCP      https(443) → 50081 [ACK] Seq=5949 Ack=483 Win=8192 Len=0 TSval=3425044735 TSecr=502919737
    145 2.131723       42.62.69.169          172.17.32.142         TCP      https(443) → 50082 [SYN, ACK] Seq=0 Ack=1 Win=5792 Len=0 MSS=1460 SACK_PERM=1 TSval=3425044757 TSecr=502919756 WS=512
    146 2.131793       172.17.32.142         42.62.69.169          TCP      50082 → https(443) [ACK] Seq=1 Ack=1 Win=131744 Len=0 TSval=502919807 TSecr=3425044757
    147 2.134816       172.17.32.142         42.62.69.169          TLSv1.2  Client Hello
    148 2.185694       42.62.69.169          172.17.32.142         TCP      https(443) → 50082 [ACK] Seq=1 Ack=176 Win=7168 Len=0 TSval=3425044812 TSecr=502919810
    149 2.187896       42.62.69.169          172.17.32.142         TLSv1.2  Server Hello
    150 2.187900       42.62.69.169          172.17.32.142         TCP      [TCP segment of a reassembled PDU]
    151 2.187901       42.62.69.169          172.17.32.142         TLSv1.2  Certificate[TCP segment of a reassembled PDU]
    152 2.187902       42.62.69.169          172.17.32.142         TLSv1.2  Certificate Status, Server Key Exchange, Server Hello Done
    153 2.187987       172.17.32.142         42.62.69.169          TCP      50082 → https(443) [ACK] Seq=176 Ack=2897 Win=128864 Len=0 TSval=502919862 TSecr=3425044814
    154 2.187988       172.17.32.142         42.62.69.169          TCP      50082 → https(443) [ACK] Seq=176 Ack=4913 Win=126848 Len=0 TSval=502919862 TSecr=3425044814
    155 2.188032       172.17.32.142         42.62.69.169          TCP      [TCP Window Update] 50082 → https(443) [ACK] Seq=176 Ack=4913 Win=131072 Len=0 TSval=502919862 TSecr=3425044814
    156 2.218033       172.17.32.142         42.62.69.169          TLSv1.2  Client Key Exchange, Change Cipher Spec, Hello Request, Hello Request
    157 2.278658       42.62.69.169          172.17.32.142         TLSv1.2  Change Cipher Spec, Encrypted Handshake Message
    158 2.278714       172.17.32.142         42.62.69.169          TLSv1.2  Application Data
    159 2.341399       42.62.69.169          172.17.32.142         TLSv1.2  Application Data
    160 2.341403       42.62.69.169          172.17.32.142         TLSv1.2  Encrypted Alert
    161 2.341473       172.17.32.142         42.62.69.169          TCP      50082 → https(443) [ACK] Seq=482 Ack=5917 Win=130112 Len=0 TSval=502920014 TSecr=3425044956
    162 2.341474       172.17.32.142         42.62.69.169          TCP      50082 → https(443) [ACK] Seq=482 Ack=5949 Win=130080 Len=0 TSval=502920014 TSecr=3425044956
    163 2.344025       172.17.32.142         42.62.69.169          TCP      50082 → https(443) [FIN, ACK] Seq=482 Ack=5949 Win=131072 Len=0 TSval=502920016 TSecr=3425044956
    164 2.347962       172.17.32.142         42.62.69.169          TCP      50083 → https(443) [SYN] Seq=0 Win=65535 Len=0 MSS=1460 WS=32 TSval=502920019 TSecr=0 SACK_PERM=1
    165 2.396004       42.62.69.169          172.17.32.142         TCP      https(443) → 50083 [SYN, ACK] Seq=0 Ack=1 Win=5792 Len=0 MSS=1460 SACK_PERM=1 TSval=3425045023 TSecr=502920019 WS=512
    166 2.396069       172.17.32.142         42.62.69.169          TCP      50083 → https(443) [ACK] Seq=1 Ack=1 Win=131744 Len=0 TSval=502920066 TSecr=3425045023
    167 2.398472       172.17.32.142         42.62.69.169          TLSv1.2  Client Hello
    168 2.405255       42.62.69.169          172.17.32.142         TCP      https(443) → 50082 [ACK] Seq=5949 Ack=483 Win=8192 Len=0 TSval=3425045021 TSecr=502920016
    169 2.446804       42.62.69.169          172.17.32.142         TCP      https(443) → 50083 [ACK] Seq=1 Ack=176 Win=7168 Len=0 TSval=3425045073 TSecr=502920068
    170 2.446809       42.62.69.169          172.17.32.142         TLSv1.2  Server Hello
    171 2.446811       42.62.69.169          172.17.32.142         TCP      [TCP segment of a reassembled PDU]
    172 2.446862       42.62.69.169          172.17.32.142         TLSv1.2  Certificate[TCP segment of a reassembled PDU]
    173 2.446874       172.17.32.142         42.62.69.169          TCP      50083 → https(443) [ACK] Seq=176 Ack=2897 Win=128864 Len=0 TSval=502920115 TSecr=3425045075
    174 2.446930       172.17.32.142         42.62.69.169          TCP      50083 → https(443) [ACK] Seq=176 Ack=4345 Win=131072 Len=0 TSval=502920115 TSecr=3425045075
    175 2.449482       42.62.69.169          172.17.32.142         TLSv1.2  Certificate Status, Server Key Exchange, Server Hello Done
    176 2.449553       172.17.32.142         42.62.69.169          TCP      50083 → https(443) [ACK] Seq=176 Ack=4913 Win=130496 Len=0 TSval=502920117 TSecr=3425045075
    177 2.476740       172.17.32.142         42.62.69.169          TLSv1.2  Client Key Exchange, Change Cipher Spec, Hello Request, Hello Request
    178 2.525308       42.62.69.169          172.17.32.142         TLSv1.2  Change Cipher Spec, Encrypted Handshake Message
    179 2.525373       172.17.32.142         42.62.69.169          TLSv1.2  Application Data
    180 2.576010       42.62.69.169          172.17.32.142         TLSv1.2  Application Data
    181 2.576015       42.62.69.169          172.17.32.142         TLSv1.2  Encrypted Alert
    182 2.576076       172.17.32.142         42.62.69.169          TCP      50083 → https(443) [ACK] Seq=482 Ack=5917 Win=130112 Len=0 TSval=502920241 TSecr=3425045200
    183 2.576076       172.17.32.142         42.62.69.169          TCP      50083 → https(443) [ACK] Seq=482 Ack=5949 Win=130080 Len=0 TSval=502920241 TSecr=3425045200
    184 2.577951       172.17.32.142         42.62.69.169          TCP      50083 → https(443) [FIN, ACK] Seq=482 Ack=5949 Win=131072 Len=0 TSval=502920242 TSecr=3425045200
    185 2.579907       172.17.32.142         42.62.69.169          TCP      50085 → https(443) [SYN] Seq=0 Win=65535 Len=0 MSS=1460 WS=32 TSval=502920243 TSecr=0 SACK_PERM=1
    186 2.626185       42.62.69.169          172.17.32.142         TCP      https(443) → 50083 [ACK] Seq=5949 Ack=483 Win=8192 Len=0 TSval=3425045253 TSecr=502920242
    187 2.627893       42.62.69.169          172.17.32.142         TCP      https(443) → 50085 [SYN, ACK] Seq=0 Ack=1 Win=5792 Len=0 MSS=1460 SACK_PERM=1 TSval=3425045254 TSecr=502920243 WS=512
    188 2.627953       172.17.32.142         42.62.69.169          TCP      50085 → https(443) [ACK] Seq=1 Ack=1 Win=131744 Len=0 TSval=502920290 TSecr=3425045254
    189 2.629693       172.17.32.142         42.62.69.169          TLSv1.2  Client Hello
    190 2.678142       42.62.69.169          172.17.32.142         TCP      https(443) → 50085 [ACK] Seq=1 Ack=176 Win=7168 Len=0 TSval=3425045305 TSecr=502920291
    191 2.680593       42.62.69.169          172.17.32.142         TLSv1.2  Server Hello
    192 2.680598       42.62.69.169          172.17.32.142         TCP      [TCP segment of a reassembled PDU]
    193 2.680599       42.62.69.169          172.17.32.142         TLSv1.2  Certificate[TCP segment of a reassembled PDU]
    194 2.680600       42.62.69.169          172.17.32.142         TLSv1.2  Certificate Status, Server Key Exchange, Server Hello Done
    195 2.680652       172.17.32.142         42.62.69.169          TCP      50085 → https(443) [ACK] Seq=176 Ack=2897 Win=128864 Len=0 TSval=502920341 TSecr=3425045306
    196 2.680652       172.17.32.142         42.62.69.169          TCP      50085 → https(443) [ACK] Seq=176 Ack=4913 Win=126848 Len=0 TSval=502920341 TSecr=3425045306
    197 2.680700       172.17.32.142         42.62.69.169          TCP      [TCP Window Update] 50085 → https(443) [ACK] Seq=176 Ack=4913 Win=131072 Len=0 TSval=502920341 TSecr=3425045306
    198 2.711950       172.17.32.142         42.62.69.169          TLSv1.2  Client Key Exchange, Change Cipher Spec, Hello Request, Hello Request
    199 2.762828       42.62.69.169          172.17.32.142         TLSv1.2  Change Cipher Spec, Encrypted Handshake Message
    200 2.762913       172.17.32.142         42.62.69.169          TLSv1.2  Application Data
    201 2.812543       42.62.69.169          172.17.32.142         TLSv1.2  Application Data
    202 2.812549       42.62.69.169          172.17.32.142         TLSv1.2  Encrypted Alert
    203 2.812653       172.17.32.142         42.62.69.169          TCP      50085 → https(443) [ACK] Seq=482 Ack=5917 Win=130112 Len=0 TSval=502920469 TSecr=3425045437
    204 2.812656       172.17.32.142         42.62.69.169          TCP      50085 → https(443) [ACK] Seq=482 Ack=5949 Win=130080 Len=0 TSval=502920469 TSecr=3425045437
    205 2.816638       172.17.32.142         42.62.69.169          TCP      50085 → https(443) [FIN, ACK] Seq=482 Ack=5949 Win=131072 Len=0 TSval=502920473 TSecr=3425045437
    206 2.819353       172.17.32.142         42.62.69.169          TCP      50087 → https(443) [SYN] Seq=0 Win=65535 Len=0 MSS=1460 WS=32 TSval=502920475 TSecr=0 SACK_PERM=1
    207 2.874401       42.62.69.169          172.17.32.142         TCP      https(443) → 50085 [ACK] Seq=5949 Ack=483 Win=8192 Len=0 TSval=3425045491 TSecr=502920473
    208 2.874409       42.62.69.169          172.17.32.142         TCP      https(443) → 50087 [SYN, ACK] Seq=0 Ack=1 Win=5792 Len=0 MSS=1460 SACK_PERM=1 TSval=3425045495 TSecr=502920475 WS=512
    209 2.874503       172.17.32.142         42.62.69.169          TCP      50087 → https(443) [ACK] Seq=1 Ack=1 Win=131744 Len=0 TSval=502920530 TSecr=3425045495
    210 2.878870       172.17.32.142         42.62.69.169          TLSv1.2  Client Hello
    211 2.930818       42.62.69.169          172.17.32.142         TCP      https(443) → 50087 [ACK] Seq=1 Ack=176 Win=7168 Len=0 TSval=3425045556 TSecr=502920534
    212 2.931925       42.62.69.169          172.17.32.142         TLSv1.2  Server Hello
    213 2.931936       42.62.69.169          172.17.32.142         TCP      [TCP segment of a reassembled PDU]
    214 2.931938       42.62.69.169          172.17.32.142         TLSv1.2  Certificate[TCP segment of a reassembled PDU]
    215 2.931939       42.62.69.169          172.17.32.142         TLSv1.2  Certificate Status, Server Key Exchange, Server Hello Done
    216 2.932097       172.17.32.142         42.62.69.169          TCP      50087 → https(443) [ACK] Seq=176 Ack=2897 Win=128864 Len=0 TSval=502920585 TSecr=3425045557
    217 2.932098       172.17.32.142         42.62.69.169          TCP      50087 → https(443) [ACK] Seq=176 Ack=4913 Win=126848 Len=0 TSval=502920585 TSecr=3425045557
    218 2.932184       172.17.32.142         42.62.69.169          TCP      [TCP Window Update] 50087 → https(443) [ACK] Seq=176 Ack=4913 Win=131072 Len=0 TSval=502920585 TSecr=3425045557
    219 2.969858       172.17.32.142         42.62.69.169          TLSv1.2  Client Key Exchange, Change Cipher Spec, Hello Request, Hello Request
    220 3.021005       42.62.69.169          172.17.32.142         TLSv1.2  Change Cipher Spec, Encrypted Handshake Message
    221 3.021084       172.17.32.142         42.62.69.169          TLSv1.2  Application Data
    222 3.074018       42.62.69.169          172.17.32.142         TLSv1.2  Application Data
    223 3.074021       42.62.69.169          172.17.32.142         TLSv1.2  Encrypted Alert
    224 3.074079       172.17.32.142         42.62.69.169          TCP      50087 → https(443) [ACK] Seq=482 Ack=5917 Win=130112 Len=0 TSval=502920725 TSecr=3425045697
    225 3.074080       172.17.32.142         42.62.69.169          TCP      50087 → https(443) [ACK] Seq=482 Ack=5949 Win=130080 Len=0 TSval=502920725 TSecr=3425045697
    226 3.076098       172.17.32.142         42.62.69.169          TCP      50087 → https(443) [FIN, ACK] Seq=482 Ack=5949 Win=131072 Len=0 TSval=502920727 TSecr=3425045697
    227 3.078161       172.17.32.142         42.62.69.169          TCP      50089 → https(443) [SYN] Seq=0 Win=65535 Len=0 MSS=1460 WS=32 TSval=502920729 TSecr=0 SACK_PERM=1
    228 3.127047       42.62.69.169          172.17.32.142         TCP      https(443) → 50089 [SYN, ACK] Seq=0 Ack=1 Win=5792 Len=0 MSS=1460 SACK_PERM=1 TSval=3425045753 TSecr=502920729 WS=512
    229 3.127151       172.17.32.142         42.62.69.169          TCP      50089 → https(443) [ACK] Seq=1 Ack=1 Win=131744 Len=0 TSval=502920778 TSecr=3425045753
    230 3.130650       172.17.32.142         42.62.69.169          TLSv1.2  Client Hello
    231 3.136677       42.62.69.169          172.17.32.142         TCP      https(443) → 50087 [ACK] Seq=5949 Ack=483 Win=8192 Len=0 TSval=3425045752 TSecr=502920727
    232 3.178120       42.62.69.169          172.17.32.142         TCP      https(443) → 50089 [ACK] Seq=1 Ack=176 Win=7168 Len=0 TSval=3425045806 TSecr=502920781
    233 3.186787       42.62.69.169          172.17.32.142         TLSv1.2  Server Hello
    234 3.186795       42.62.69.169          172.17.32.142         TCP      [TCP segment of a reassembled PDU]
    235 3.186797       42.62.69.169          172.17.32.142         TLSv1.2  Certificate[TCP segment of a reassembled PDU]
    236 3.186799       42.62.69.169          172.17.32.142         TLSv1.2  Certificate Status, Server Key Exchange, Server Hello Done
    237 3.186894       172.17.32.142         42.62.69.169          TCP      50089 → https(443) [ACK] Seq=176 Ack=2897 Win=128864 Len=0 TSval=502920836 TSecr=3425045807
    238 3.186895       172.17.32.142         42.62.69.169          TCP      50089 → https(443) [ACK] Seq=176 Ack=4913 Win=126848 Len=0 TSval=502920836 TSecr=3425045807
    239 3.186999       172.17.32.142         42.62.69.169          TCP      [TCP Window Update] 50089 → https(443) [ACK] Seq=176 Ack=4913 Win=131072 Len=0 TSval=502920836 TSecr=3425045807
    240 3.210249       172.17.32.142         42.62.69.169          TLSv1.2  Client Key Exchange, Change Cipher Spec, Hello Request, Hello Request
    241 3.269811       42.62.69.169          172.17.32.142         TLSv1.2  Change Cipher Spec, Encrypted Handshake Message
    242 3.269937       172.17.32.142         42.62.69.169          TLSv1.2  Application Data
    243 3.320674       42.62.69.169          172.17.32.142         TLSv1.2  Application Data
    244 3.320680       42.62.69.169          172.17.32.142         TLSv1.2  Encrypted Alert
    245 3.320764       172.17.32.142         42.62.69.169          TCP      50089 → https(443) [ACK] Seq=482 Ack=5917 Win=130112 Len=0 TSval=502920968 TSecr=3425045945
    246 3.320766       172.17.32.142         42.62.69.169          TCP      50089 → https(443) [ACK] Seq=482 Ack=5949 Win=130080 Len=0 TSval=502920968 TSecr=3425045945
    247 3.323682       172.17.32.142         42.62.69.169          TCP      50089 → https(443) [FIN, ACK] Seq=482 Ack=5949 Win=131072 Len=0 TSval=502920970 TSecr=3425045945
    248 3.328179       172.17.32.142         42.62.69.169          TCP      50090 → https(443) [SYN] Seq=0 Win=65535 Len=0 MSS=1460 WS=32 TSval=502920974 TSecr=0 SACK_PERM=1
    249 3.374427       42.62.69.169          172.17.32.142         TCP      https(443) → 50089 [ACK] Seq=5949 Ack=483 Win=8192 Len=0 TSval=3425045999 TSecr=502920970
    250 3.374433       42.62.69.169          172.17.32.142         TCP      https(443) → 50090 [SYN, ACK] Seq=0 Ack=1 Win=5792 Len=0 MSS=1460 SACK_PERM=1 TSval=3425046003 TSecr=502920974 WS=512
    251 3.374523       172.17.32.142         42.62.69.169          TCP      50090 → https(443) [ACK] Seq=1 Ack=1 Win=131744 Len=0 TSval=502921020 TSecr=3425046003
    252 3.377961       172.17.32.142         42.62.69.169          TLSv1.2  Client Hello
    253 3.424344       42.62.69.169          172.17.32.142         TCP      https(443) → 50090 [ACK] Seq=1 Ack=176 Win=7168 Len=0 TSval=3425046053 TSecr=502921023
    254 3.424349       42.62.69.169          172.17.32.142         TLSv1.2  Server Hello
    255 3.424350       42.62.69.169          172.17.32.142         TCP      [TCP segment of a reassembled PDU]
    256 3.424460       42.62.69.169          172.17.32.142         TLSv1.2  Certificate[TCP segment of a reassembled PDU]
    257 3.424463       42.62.69.169          172.17.32.142         TLSv1.2  Certificate Status, Server Key Exchange, Server Hello Done
    258 3.424546       172.17.32.142         42.62.69.169          TCP      50090 → https(443) [ACK] Seq=176 Ack=2897 Win=128864 Len=0 TSval=502921068 TSecr=3425046054
    259 3.424549       172.17.32.142         42.62.69.169          TCP      50090 → https(443) [ACK] Seq=176 Ack=4913 Win=126848 Len=0 TSval=502921068 TSecr=3425046054
    260 3.425063       172.17.32.142         42.62.69.169          TCP      [TCP Window Update] 50090 → https(443) [ACK] Seq=176 Ack=4913 Win=131072 Len=0 TSval=502921068 TSecr=3425046054
    261 3.443831       172.17.32.142         42.62.69.169          TLSv1.2  Client Key Exchange, Change Cipher Spec, Hello Request, Hello Request
    262 3.491680       42.62.69.169          172.17.32.142         TLSv1.2  Change Cipher Spec, Encrypted Handshake Message
    263 3.491828       172.17.32.142         42.62.69.169          TLSv1.2  Application Data
    264 3.540796       42.62.69.169          172.17.32.142         TLSv1.2  Application Data
    265 3.540800       42.62.69.169          172.17.32.142         TLSv1.2  Encrypted Alert
    266 3.540865       172.17.32.142         42.62.69.169          TCP      50090 → https(443) [ACK] Seq=482 Ack=5917 Win=130112 Len=0 TSval=502921183 TSecr=3425046168
    267 3.540866       172.17.32.142         42.62.69.169          TCP      50090 → https(443) [ACK] Seq=482 Ack=5949 Win=130080 Len=0 TSval=502921183 TSecr=3425046168
    268 3.544726       172.17.32.142         42.62.69.169          TCP      50090 → https(443) [FIN, ACK] Seq=482 Ack=5949 Win=131072 Len=0 TSval=502921186 TSecr=3425046168
    269 3.547563       172.17.32.142         42.62.69.169          TCP      50091 → https(443) [SYN] Seq=0 Win=65535 Len=0 MSS=1460 WS=32 TSval=502921188 TSecr=0 SACK_PERM=1
    270 3.592205       42.62.69.169          172.17.32.142         TCP      https(443) → 50090 [ACK] Seq=5949 Ack=483 Win=8192 Len=0 TSval=3425046219 TSecr=502921186
    271 3.613127       42.62.69.169          172.17.32.142         TCP      https(443) → 50091 [SYN, ACK] Seq=0 Ack=1 Win=5792 Len=0 MSS=1460 SACK_PERM=1 TSval=3425046224 TSecr=502921188 WS=512
    272 3.613201       172.17.32.142         42.62.69.169          TCP      50091 → https(443) [ACK] Seq=1 Ack=1 Win=131744 Len=0 TSval=502921252 TSecr=3425046224
    273 3.616099       172.17.32.142         42.62.69.169          TLSv1.2  Client Hello
    274 3.678136       42.62.69.169          172.17.32.142         TCP      https(443) → 50091 [ACK] Seq=1 Ack=176 Win=7168 Len=0 TSval=3425046292 TSecr=502921254
    275 3.690857       42.62.69.169          172.17.32.142         TLSv1.2  Server Hello
    276 3.690865       42.62.69.169          172.17.32.142         TCP      [TCP segment of a reassembled PDU]
    277 3.690948       172.17.32.142         42.62.69.169          TCP      50091 → https(443) [ACK] Seq=176 Ack=2897 Win=128864 Len=0 TSval=502921328 TSecr=3425046293
    278 3.698497       42.62.69.169          172.17.32.142         TLSv1.2  Certificate[TCP segment of a reassembled PDU]
    279 3.698503       42.62.69.169          172.17.32.142         TLSv1.2  Certificate Status, Server Key Exchange, Server Hello Done
    280 3.698577       172.17.32.142         42.62.69.169          TCP      50091 → https(443) [ACK] Seq=176 Ack=4913 Win=129056 Len=0 TSval=502921335 TSecr=3425046293
    281 3.719978       172.17.32.142         42.62.69.169          TLSv1.2  Client Key Exchange, Change Cipher Spec, Hello Request, Hello Request
    282 3.782730       42.62.69.169          172.17.32.142         TLSv1.2  Change Cipher Spec, Encrypted Handshake Message
