No.     Time           Source                Destination           Protocol Info
      1 0.000000       172.17.32.142         27.148.145.195        TCP      56063 → https(443) [SYN] Seq=0 Win=65535 Len=0 MSS=1460 WS=32 TSval=663685980 TSecr=0 SACK_PERM=1
      2 0.015949       27.148.145.195        172.17.32.142         TCP      https(443) → 56063 [SYN, ACK] Seq=0 Ack=1 Win=14600 Len=0 MSS=1460 SACK_PERM=1 WS=128
      3 0.016031       172.17.32.142         27.148.145.195        TCP      56063 → https(443) [ACK] Seq=1 Ack=1 Win=262144 Len=0
      4 0.018201       172.17.32.142         27.148.145.195        TLSv1.2  Client Hello
      5 0.030358       27.148.145.195        172.17.32.142         TLSv1.2  Server Hello
      6 0.030667       27.148.145.195        172.17.32.142         TCP      [TCP segment of a reassembled PDU]
      7 0.030749       172.17.32.142         27.148.145.195        TCP      56063 → https(443) [ACK] Seq=518 Ack=2921 Win=260672 Len=0
      8 0.032047       27.148.145.195        172.17.32.142         TLSv1.2  Certificate[TCP segment of a reassembled PDU]
      9 0.032225       172.17.32.142         27.148.145.195        TCP      56063 → https(443) [ACK] Seq=518 Ack=4097 Win=260960 Len=0
     10 0.034284       27.148.145.195        172.17.32.142         TCP      https(443) → 56063 [ACK] Seq=1 Ack=518 Win=15744 Len=0
     11 0.034354       172.17.32.142         27.148.145.195        TCP      [TCP Window Update] 56063 → https(443) [ACK] Seq=518 Ack=4097 Win=262144 Len=0
     12 0.035291       27.148.145.195        172.17.32.142         TLSv1.2  Certificate Status, Server Key Exchange, Server Hello Done
     13 0.035346       172.17.32.142         27.148.145.195        TCP      56063 → https(443) [ACK] Seq=518 Ack=4746 Win=261472 Len=0
     14 0.115794       172.17.32.142         27.148.145.195        TLSv1.2  Client Key Exchange, Change Cipher Spec, Hello Request, Hello Request
     15 0.132842       27.148.145.195        172.17.32.142         TLSv1.2  New Session Ticket, Change Cipher Spec, Encrypted Handshake Message
     16 0.132906       172.17.32.142         27.148.145.195        TCP      56063 → https(443) [ACK] Seq=644 Ack=4988 Win=261888 Len=0
     17 0.141036       172.17.32.142         27.148.145.195        TLSv1.2  Application Data
     18 0.196604       172.17.32.142         27.148.145.195        TCP      [TCP Retransmission] 56063 → https(443) [PSH, ACK] Seq=644 Ack=4988 Win=262144 Len=142
     19 0.202050       27.148.145.195        172.17.32.142         TCP      https(443) → 56063 [ACK] Seq=4988 Ack=786 Win=16768 Len=0
     20 0.214147       27.148.145.195        172.17.32.142         TCP      [TCP Dup ACK 19#1] https(443) → 56063 [ACK] Seq=4988 Ack=786 Win=16768 Len=0 SLE=644 SRE=786
     21 0.323425       27.148.145.195        172.17.32.142         TLSv1.2  Application Data
     22 0.323475       172.17.32.142         27.148.145.195        TCP      56063 → https(443) [ACK] Seq=786 Ack=5361 Win=261760 Len=0
     23 0.325017       27.148.145.195        172.17.32.142         TLSv1.2  Application Data
     24 0.325065       172.17.32.142         27.148.145.195        TCP      56063 → https(443) [ACK] Seq=786 Ack=5462 Win=262016 Len=0
     25 0.325409       27.148.145.195        172.17.32.142         TLSv1.2  Encrypted Alert
     26 0.325446       172.17.32.142         27.148.145.195        TCP      56063 → https(443) [ACK] Seq=786 Ack=5493 Win=262112 Len=0
     27 0.326727       27.148.145.195        172.17.32.142         TCP      https(443) → 56063 [FIN, ACK] Seq=5493 Ack=786 Win=16768 Len=0
     28 0.326790       172.17.32.142         27.148.145.195        TCP      56063 → https(443) [ACK] Seq=786 Ack=5494 Win=262144 Len=0
     29 0.333642       172.17.32.142         27.148.145.195        TLSv1.2  Encrypted Alert
     30 0.334014       172.17.32.142         27.148.145.195        TCP      56063 → https(443) [FIN, ACK] Seq=817 Ack=5494 Win=262144 Len=0
     31 0.346654       27.148.145.195        172.17.32.142         TCP      https(443) → 56063 [RST] Seq=5494 Win=0 Len=0
     32 0.347371       27.148.145.195        172.17.32.142         TCP      https(443) → 56063 [RST] Seq=5494 Win=0 Len=0
     33 0.639470       172.17.32.142         106.122.254.22        TCP      56064 → https(443) [SYN] Seq=0 Win=65535 Len=0 MSS=1460 WS=32 TSval=663686610 TSecr=0 SACK_PERM=1
     34 0.655056       106.122.254.22        172.17.32.142         TCP      https(443) → 56064 [SYN, ACK] Seq=0 Ack=1 Win=65535 Len=0 MSS=1460 SACK_PERM=1 WS=128
     35 0.655156       172.17.32.142         106.122.254.22        TCP      56064 → https(443) [ACK] Seq=1 Ack=1 Win=262144 Len=0
     36 0.657191       172.17.32.142         106.122.254.22        TLSv1.2  Client Hello
     37 0.671151       106.122.254.22        172.17.32.142         TCP      https(443) → 56064 [ACK] Seq=1 Ack=518 Win=176768 Len=0
     38 0.672589       106.122.254.22        172.17.32.142         TLSv1.2  Server Hello, Change Cipher Spec, Encrypted Handshake Message
     39 0.672661       172.17.32.142         106.122.254.22        TCP      56064 → https(443) [ACK] Seq=518 Ack=138 Win=261984 Len=0
     40 0.673784       172.17.32.142         106.122.254.22        TLSv1.2  Change Cipher Spec, Hello Request, Hello Request
     41 0.728801       106.122.254.22        172.17.32.142         TCP      https(443) → 56064 [ACK] Seq=138 Ack=569 Win=176768 Len=0
     42 0.728879       172.17.32.142         106.122.254.22        TLSv1.2  Application Data
     43 0.745159       106.122.254.22        172.17.32.142         TCP      https(443) → 56064 [ACK] Seq=138 Ack=711 Win=182528 Len=0
     44 0.782405       106.122.254.22        172.17.32.142         TLSv1.2  Application Data
     45 0.782450       172.17.32.142         106.122.254.22        TCP      56064 → https(443) [ACK] Seq=711 Ack=512 Win=261760 Len=0
     46 0.782797       106.122.254.22        172.17.32.142         TLSv1.2  Application Data
     47 0.782838       172.17.32.142         106.122.254.22        TCP      56064 → https(443) [ACK] Seq=711 Ack=613 Win=262016 Len=0
     48 0.783536       106.122.254.22        172.17.32.142         TLSv1.2  Encrypted Alert
     49 0.783590       172.17.32.142         106.122.254.22        TCP      56064 → https(443) [ACK] Seq=711 Ack=644 Win=262112 Len=0
     50 0.784682       106.122.254.22        172.17.32.142         TCP      https(443) → 56064 [FIN, ACK] Seq=644 Ack=711 Win=182528 Len=0
     51 0.784744       172.17.32.142         106.122.254.22        TCP      56064 → https(443) [ACK] Seq=711 Ack=645 Win=262144 Len=0
     52 0.788520       172.17.32.142         106.122.254.22        TLSv1.2  Encrypted Alert
     53 0.788842       172.17.32.142         106.122.254.22        TCP      56064 → https(443) [FIN, ACK] Seq=742 Ack=645 Win=262144 Len=0
     54 0.805809       106.122.254.22        172.17.32.142         TCP      https(443) → 56064 [RST] Seq=645 Win=0 Len=0
     55 0.807666       106.122.254.22        172.17.32.142         TCP      https(443) → 56064 [RST] Seq=645 Win=0 Len=0
     56 1.092885       172.17.32.142         27.148.145.195        TCP      56065 → https(443) [SYN] Seq=0 Win=65535 Len=0 MSS=1460 WS=32 TSval=663687056 TSecr=0 SACK_PERM=1
     57 1.105713       27.148.145.195        172.17.32.142         TCP      https(443) → 56065 [SYN, ACK] Seq=0 Ack=1 Win=14600 Len=0 MSS=1460 SACK_PERM=1 WS=128
     58 1.105777       172.17.32.142         27.148.145.195        TCP      56065 → https(443) [ACK] Seq=1 Ack=1 Win=262144 Len=0
     59 1.107499       172.17.32.142         27.148.145.195        TLSv1.2  Client Hello
     60 1.123567       27.148.145.195        172.17.32.142         TCP      https(443) → 56065 [ACK] Seq=1 Ack=518 Win=15744 Len=0
     61 1.130913       27.148.145.195        172.17.32.142         TLSv1.2  Server Hello, Change Cipher Spec, Encrypted Handshake Message
     62 1.131148       172.17.32.142         27.148.145.195        TCP      56065 → https(443) [ACK] Seq=518 Ack=142 Win=261984 Len=0
     63 1.133669       172.17.32.142         27.148.145.195        TLSv1.2  Change Cipher Spec, Hello Request, Hello Request
     64 1.141534       27.148.145.195        172.17.32.142         TLSv1.2  [TCP Spurious Retransmission] , Server Hello, Change Cipher Spec, Encrypted Handshake Message
     65 1.141806       172.17.32.142         27.148.145.195        TCP      [TCP Dup ACK 62#1] 56065 → https(443) [ACK] Seq=569 Ack=142 Win=262144 Len=0 SLE=1 SRE=142
     66 1.188493       27.148.145.195        172.17.32.142         TCP      https(443) → 56065 [ACK] Seq=142 Ack=569 Win=15744 Len=0
     67 1.188612       172.17.32.142         27.148.145.195        TLSv1.2  Application Data
     68 1.207729       27.148.145.195        172.17.32.142         TCP      https(443) → 56065 [ACK] Seq=142 Ack=711 Win=16768 Len=0
     69 1.240776       27.148.145.195        172.17.32.142         TLSv1.2  Application Data
     70 1.240844       172.17.32.142         27.148.145.195        TCP      56065 → https(443) [ACK] Seq=711 Ack=515 Win=261760 Len=0
     71 1.241208       27.148.145.195        172.17.32.142         TLSv1.2  Application Data
     72 1.241244       172.17.32.142         27.148.145.195        TCP      56065 → https(443) [ACK] Seq=711 Ack=616 Win=262016 Len=0
     73 1.242978       27.148.145.195        172.17.32.142         TLSv1.2  Encrypted Alert
     74 1.243031       172.17.32.142         27.148.145.195        TCP      56065 → https(443) [ACK] Seq=711 Ack=647 Win=262112 Len=0
     75 1.243896       27.148.145.195        172.17.32.142         TCP      https(443) → 56065 [FIN, ACK] Seq=647 Ack=711 Win=16768 Len=0
     76 1.243948       172.17.32.142         27.148.145.195        TCP      56065 → https(443) [ACK] Seq=711 Ack=648 Win=262144 Len=0
     77 1.246919       172.17.32.142         27.148.145.195        TLSv1.2  Encrypted Alert
     78 1.247305       172.17.32.142         27.148.145.195        TCP      56065 → https(443) [FIN, ACK] Seq=742 Ack=648 Win=262144 Len=0
     79 1.259116       27.148.145.195        172.17.32.142         TCP      https(443) → 56065 [RST] Seq=648 Win=0 Len=0
     80 1.260211       27.148.145.195        172.17.32.142         TCP      https(443) → 56065 [RST] Seq=648 Win=0 Len=0
     81 1.556828       172.17.32.142         106.122.254.22        TCP      56066 → https(443) [SYN] Seq=0 Win=65535 Len=0 MSS=1460 WS=32 TSval=663687508 TSecr=0 SACK_PERM=1
     82 1.573379       106.122.254.22        172.17.32.142         TCP      https(443) → 56066 [SYN, ACK] Seq=0 Ack=1 Win=65535 Len=0 MSS=1460 SACK_PERM=1 WS=128
     83 1.573461       172.17.32.142         106.122.254.22        TCP      56066 → https(443) [ACK] Seq=1 Ack=1 Win=262144 Len=0
     84 1.577545       172.17.32.142         106.122.254.22        TLSv1.2  Client Hello
     85 1.592526       106.122.254.22        172.17.32.142         TCP      https(443) → 56066 [ACK] Seq=1 Ack=518 Win=176768 Len=0
     86 1.600851       106.122.254.22        172.17.32.142         TLSv1.2  Server Hello, Change Cipher Spec, Encrypted Handshake Message
     87 1.600909       172.17.32.142         106.122.254.22        TCP      56066 → https(443) [ACK] Seq=518 Ack=138 Win=261984 Len=0
     88 1.601740       172.17.32.142         106.122.254.22        TLSv1.2  Change Cipher Spec, Hello Request, Hello Request
     89 1.614990       106.122.254.22        172.17.32.142         TLSv1.2  [TCP Spurious Retransmission] , Server Hello, Change Cipher Spec, Encrypted Handshake Message
     90 1.615037       172.17.32.142         106.122.254.22        TLSv1.2  Application Data
     91 1.645000       106.122.254.22        172.17.32.142         TCP      https(443) → 56066 [ACK] Seq=138 Ack=711 Win=182528 Len=0
     92 1.679523       106.122.254.22        172.17.32.142         TLSv1.2  Application Data
     93 1.679615       172.17.32.142         106.122.254.22        TCP      56066 → https(443) [ACK] Seq=711 Ack=512 Win=261760 Len=0
     94 1.680139       106.122.254.22        172.17.32.142         TLSv1.2  Application Data
     95 1.680209       172.17.32.142         106.122.254.22        TCP      56066 → https(443) [ACK] Seq=711 Ack=613 Win=262016 Len=0
     96 1.681261       106.122.254.22        172.17.32.142         TLSv1.2  Encrypted Alert
     97 1.681356       172.17.32.142         106.122.254.22        TCP      56066 → https(443) [ACK] Seq=711 Ack=644 Win=262112 Len=0
     98 1.682515       106.122.254.22        172.17.32.142         TCP      https(443) → 56066 [FIN, ACK] Seq=644 Ack=711 Win=182528 Len=0
     99 1.682578       172.17.32.142         106.122.254.22        TCP      56066 → https(443) [ACK] Seq=711 Ack=645 Win=262144 Len=0
    100 1.689041       172.17.32.142         106.122.254.22        TLSv1.2  Encrypted Alert
    101 1.689776       172.17.32.142         106.122.254.22        TCP      56066 → https(443) [FIN, ACK] Seq=742 Ack=645 Win=262144 Len=0
    102 1.698283       106.122.254.22        172.17.32.142         TCP      https(443) → 56066 [RST] Seq=645 Win=0 Len=0
    103 1.705845       106.122.254.22        172.17.32.142         TCP      https(443) → 56066 [RST] Seq=645 Win=0 Len=0
    104 1.994112       172.17.32.142         27.148.145.195        TCP      56068 → https(443) [SYN] Seq=0 Win=65535 Len=0 MSS=1460 WS=32 TSval=663687936 TSecr=0 SACK_PERM=1
    105 2.007757       27.148.145.195        172.17.32.142         TCP      https(443) → 56068 [SYN, ACK] Seq=0 Ack=1 Win=14600 Len=0 MSS=1460 SACK_PERM=1 WS=128
    106 2.007855       172.17.32.142         27.148.145.195        TCP      56068 → https(443) [ACK] Seq=1 Ack=1 Win=262144 Len=0
    107 2.011103       172.17.32.142         27.148.145.195        TLSv1.2  Client Hello
    108 2.023242       27.148.145.195        172.17.32.142         TLSv1.2  Server Hello, Change Cipher Spec, Encrypted Handshake Message
    109 2.023625       172.17.32.142         27.148.145.195        TCP      56068 → https(443) [ACK] Seq=518 Ack=142 Win=261984 Len=0
    110 2.026029       27.148.145.195        172.17.32.142         TCP      https(443) → 56068 [ACK] Seq=1 Ack=518 Win=15744 Len=0
    111 2.026206       172.17.32.142         27.148.145.195        TCP      [TCP Window Update] 56068 → https(443) [ACK] Seq=518 Ack=142 Win=262144 Len=0
    112 2.028407       172.17.32.142         27.148.145.195        TLSv1.2  Change Cipher Spec, Hello Request, Hello Request
    113 2.083489       27.148.145.195        172.17.32.142         TCP      https(443) → 56068 [ACK] Seq=142 Ack=569 Win=15744 Len=0
    114 2.083539       172.17.32.142         27.148.145.195        TLSv1.2  Application Data
    115 2.100148       27.148.145.195        172.17.32.142         TCP      https(443) → 56068 [ACK] Seq=142 Ack=711 Win=16768 Len=0
    116 2.141593       27.148.145.195        172.17.32.142         TLSv1.2  Application Data
    117 2.141682       172.17.32.142         27.148.145.195        TCP      56068 → https(443) [ACK] Seq=711 Ack=515 Win=261760 Len=0
    118 2.145230       27.148.145.195        172.17.32.142         TLSv1.2  Application Data
    119 2.145295       172.17.32.142         27.148.145.195        TCP      56068 → https(443) [ACK] Seq=711 Ack=616 Win=262016 Len=0
    120 2.148158       27.148.145.195        172.17.32.142         TLSv1.2  Encrypted Alert
    121 2.148206       172.17.32.142         27.148.145.195        TCP      56068 → https(443) [ACK] Seq=711 Ack=647 Win=262112 Len=0
    122 2.149133       172.17.32.142         27.148.145.195        TLSv1.2  Encrypted Alert
    123 2.149355       172.17.32.142         27.148.145.195        TCP      56068 → https(443) [FIN, ACK] Seq=742 Ack=647 Win=262144 Len=0
    124 2.151521       27.148.145.195        172.17.32.142         TCP      https(443) → 56068 [FIN, ACK] Seq=647 Ack=711 Win=16768 Len=0
    125 2.151575       172.17.32.142         27.148.145.195        TCP      [TCP Out-Of-Order] 56068 → https(443) [FIN, ACK] Seq=742 Ack=648 Win=262144 Len=0
    126 2.166674       27.148.145.195        172.17.32.142         TCP      https(443) → 56068 [RST] Seq=647 Win=0 Len=0
    127 2.383453       172.17.32.142         27.148.145.195        TCP      [TCP Retransmission] 56068 → https(443) [FIN, PSH, ACK] Seq=711 Ack=648 Win=262144 Len=31
    128 2.400315       27.148.145.195        172.17.32.142         TCP      https(443) → 56068 [RST] Seq=648 Win=0 Len=0
    129 2.454796       172.17.32.142         106.122.254.22        TCP      56069 → https(443) [SYN] Seq=0 Win=65535 Len=0 MSS=1460 WS=32 TSval=663688384 TSecr=0 SACK_PERM=1
    130 2.471113       106.122.254.22        172.17.32.142         TCP      https(443) → 56069 [SYN, ACK] Seq=0 Ack=1 Win=65535 Len=0 MSS=1460 SACK_PERM=1 WS=128
    131 2.471199       172.17.32.142         106.122.254.22        TCP      56069 → https(443) [ACK] Seq=1 Ack=1 Win=262144 Len=0
    132 2.473782       172.17.32.142         106.122.254.22        TLSv1.2  Client Hello
    133 2.546434       172.17.32.142         106.122.254.22        TCP      [TCP Retransmission] 56069 → https(443) [PSH, ACK] Seq=1 Ack=1 Win=262144 Len=517
    134 2.559593       106.122.254.22        172.17.32.142         TLSv1.2  Server Hello, Change Cipher Spec, Encrypted Handshake Message
    135 2.559655       172.17.32.142         106.122.254.22        TCP      56069 → https(443) [ACK] Seq=518 Ack=138 Win=261984 Len=0
    136 2.560871       106.122.254.22        172.17.32.142         TCP      https(443) → 56069 [ACK] Seq=1 Ack=518 Win=176768 Len=0
    137 2.560887       172.17.32.142         106.122.254.22        TLSv1.2  Change Cipher Spec, Hello Request, Hello Request
    138 2.560931       172.17.32.142         106.122.254.22        TCP      [TCP Dup ACK 135#1] 56069 → https(443) [ACK] Seq=569 Ack=138 Win=262144 Len=0
    139 2.622822       106.122.254.22        172.17.32.142         TCP      https(443) → 56069 [ACK] Seq=138 Ack=569 Win=176768 Len=0
    140 2.622873       172.17.32.142         106.122.254.22        TLSv1.2  Application Data
    141 2.638161       106.122.254.22        172.17.32.142         TCP      https(443) → 56069 [ACK] Seq=138 Ack=711 Win=182528 Len=0
    142 2.677731       106.122.254.22        172.17.32.142         TLSv1.2  Application Data
    143 2.677809       172.17.32.142         106.122.254.22        TCP      56069 → https(443) [ACK] Seq=711 Ack=512 Win=261760 Len=0
    144 2.679344       106.122.254.22        172.17.32.142         TLSv1.2  Application Data
    145 2.679398       172.17.32.142         106.122.254.22        TCP      56069 → https(443) [ACK] Seq=711 Ack=613 Win=262016 Len=0
    146 2.679514       106.122.254.22        172.17.32.142         TLSv1.2  Encrypted Alert
    147 2.679543       172.17.32.142         106.122.254.22        TCP      56069 → https(443) [ACK] Seq=711 Ack=644 Win=262112 Len=0
    148 2.683134       106.122.254.22        172.17.32.142         TCP      https(443) → 56069 [FIN, ACK] Seq=644 Ack=711 Win=182528 Len=0
    149 2.683185       172.17.32.142         106.122.254.22        TCP      56069 → https(443) [ACK] Seq=711 Ack=645 Win=262144 Len=0
    150 2.683862       172.17.32.142         106.122.254.22        TLSv1.2  Encrypted Alert
    151 2.684437       172.17.32.142         106.122.254.22        TCP      56069 → https(443) [FIN, ACK] Seq=742 Ack=645 Win=262144 Len=0
    152 2.700980       106.122.254.22        172.17.32.142         TCP      https(443) → 56069 [RST] Seq=645 Win=0 Len=0
    153 2.702285       106.122.254.22        172.17.32.142         TCP      https(443) → 56069 [RST] Seq=645 Win=0 Len=0
    154 2.989167       172.17.32.142         27.148.145.195        TCP      56082 → https(443) [SYN] Seq=0 Win=65535 Len=0 MSS=1460 WS=32 TSval=663688906 TSecr=0 SACK_PERM=1
    155 3.006483       27.148.145.195        172.17.32.142         TCP      https(443) → 56082 [SYN, ACK] Seq=0 Ack=1 Win=14600 Len=0 MSS=1460 SACK_PERM=1 WS=128
    156 3.006562       172.17.32.142         27.148.145.195        TCP      56082 → https(443) [ACK] Seq=1 Ack=1 Win=262144 Len=0
    157 3.014341       172.17.32.142         27.148.145.195        TLSv1.2  Client Hello
    158 3.031139       27.148.145.195        172.17.32.142         TCP      https(443) → 56082 [ACK] Seq=1 Ack=518 Win=15744 Len=0
    159 3.032261       27.148.145.195        172.17.32.142         TLSv1.2  Server Hello, Change Cipher Spec, Encrypted Handshake Message
    160 3.032320       172.17.32.142         27.148.145.195        TCP      56082 → https(443) [ACK] Seq=518 Ack=142 Win=261984 Len=0
    161 3.033601       172.17.32.142         27.148.145.195        TLSv1.2  Change Cipher Spec, Hello Request, Hello Request
    162 3.089408       27.148.145.195        172.17.32.142         TCP      https(443) → 56082 [ACK] Seq=142 Ack=569 Win=15744 Len=0
    163 3.089485       172.17.32.142         27.148.145.195        TLSv1.2  Application Data
    164 3.109881       27.148.145.195        172.17.32.142         TCP      https(443) → 56082 [ACK] Seq=142 Ack=711 Win=16768 Len=0
    165 3.146936       27.148.145.195        172.17.32.142         TLSv1.2  Application Data
    166 3.146986       172.17.32.142         27.148.145.195        TCP      56082 → https(443) [ACK] Seq=711 Ack=515 Win=261760 Len=0
    167 3.147310       27.148.145.195        172.17.32.142         TLSv1.2  Application Data
    168 3.147344       172.17.32.142         27.148.145.195        TCP      56082 → https(443) [ACK] Seq=711 Ack=616 Win=262016 Len=0
    169 3.152017       172.17.32.142         27.148.145.195        TLSv1.2  Encrypted Alert
    170 3.152522       172.17.32.142         27.148.145.195        TCP      56082 → https(443) [FIN, ACK] Seq=742 Ack=616 Win=262144 Len=0
    171 3.152627       27.148.145.195        172.17.32.142         TLSv1.2  Encrypted Alert
    172 3.152683       172.17.32.142         27.148.145.195        TCP      [TCP Out-Of-Order] 56082 → https(443) [FIN, ACK] Seq=742 Ack=647 Win=262112 Len=0
    173 3.154228       27.148.145.195        172.17.32.142         TCP      https(443) → 56082 [FIN, ACK] Seq=647 Ack=711 Win=16768 Len=0
    174 3.154279       172.17.32.142         27.148.145.195        TCP      [TCP Out-Of-Order] 56082 → https(443) [FIN, ACK] Seq=742 Ack=648 Win=262144 Len=0
    175 3.163726       27.148.145.195        172.17.32.142         TCP      https(443) → 56082 [RST] Seq=616 Win=0 Len=0
    176 3.170969       27.148.145.195        172.17.32.142         TCP      https(443) → 56082 [RST] Seq=616 Win=0 Len=0
    177 3.172038       27.148.145.195        172.17.32.142         TCP      https(443) → 56082 [RST] Seq=647 Win=0 Len=0
    178 3.174383       27.148.145.195        172.17.32.142         TCP      https(443) → 56082 [RST] Seq=648 Win=0 Len=0
    179 3.459614       172.17.32.142         106.122.254.22        TCP      56083 → https(443) [SYN] Seq=0 Win=65535 Len=0 MSS=1460 WS=32 TSval=663689368 TSecr=0 SACK_PERM=1
    180 3.477607       106.122.254.22        172.17.32.142         TCP      https(443) → 56083 [SYN, ACK] Seq=0 Ack=1 Win=65535 Len=0 MSS=1460 SACK_PERM=1 WS=128
    181 3.477714       172.17.32.142         106.122.254.22        TCP      56083 → https(443) [ACK] Seq=1 Ack=1 Win=262144 Len=0
    182 3.480204       172.17.32.142         106.122.254.22        TLSv1.2  Client Hello
    183 3.491092       106.122.254.22        172.17.32.142         TLSv1.2  Server Hello, Change Cipher Spec, Encrypted Handshake Message
    184 3.491173       172.17.32.142         106.122.254.22        TCP      56083 → https(443) [ACK] Seq=518 Ack=138 Win=261984 Len=0
    185 3.492097       172.17.32.142         106.122.254.22        TLSv1.2  Change Cipher Spec, Hello Request, Hello Request
    186 3.499253       106.122.254.22        172.17.32.142         TCP      https(443) → 56083 [ACK] Seq=1 Ack=518 Win=176768 Len=0
    187 3.499310       172.17.32.142         106.122.254.22        TLSv1.2  Application Data
    188 3.515559       106.122.254.22        172.17.32.142         TCP      https(443) → 56083 [ACK] Seq=138 Ack=711 Win=182528 Len=0
    189 3.557445       106.122.254.22        172.17.32.142         TLSv1.2  Application Data
    190 3.557505       172.17.32.142         106.122.254.22        TCP      56083 → https(443) [ACK] Seq=711 Ack=512 Win=261760 Len=0
    191 3.558839       106.122.254.22        172.17.32.142         TLSv1.2  [TCP Previous segment not captured] , Encrypted Alert
    192 3.558921       172.17.32.142         106.122.254.22        TCP      [TCP Dup ACK 190#1] 56083 → https(443) [ACK] Seq=711 Ack=512 Win=261760 Len=0 SLE=613 SRE=644
    193 3.562452       106.122.254.22        172.17.32.142         TCP      [TCP Out-Of-Order] https(443) → 56083 [PSH, ACK] Seq=512 Ack=711 Win=182528 Len=101
    194 3.562543       172.17.32.142         106.122.254.22        TCP      56083 → https(443) [ACK] Seq=711 Ack=644 Win=261984 Len=0
    195 3.563119       106.122.254.22        172.17.32.142         TCP      https(443) → 56083 [FIN, ACK] Seq=644 Ack=711 Win=182528 Len=0
    196 3.563236       172.17.32.142         106.122.254.22        TCP      56083 → https(443) [ACK] Seq=711 Ack=645 Win=261984 Len=0
    197 3.575301       106.122.254.22        172.17.32.142         TCP      [TCP Out-Of-Order] https(443) → 56083 [PSH, ACK] Seq=512 Ack=711 Win=182528 Len=101
    198 3.575369       172.17.32.142         106.122.254.22        TCP      [TCP Window Update] 56083 → https(443) [ACK] Seq=711 Ack=645 Win=262144 Len=0 SLE=512 SRE=613
    199 3.628740       172.17.32.142         106.122.254.22        TLSv1.2  Encrypted Alert
    200 3.629221       172.17.32.142         106.122.254.22        TCP      56083 → https(443) [FIN, ACK] Seq=742 Ack=645 Win=262144 Len=0
    201 3.639324       106.122.254.22        172.17.32.142         TCP      https(443) → 56083 [RST] Seq=645 Win=0 Len=0
    202 3.641281       106.122.254.22        172.17.32.142         TCP      https(443) → 56083 [RST] Seq=645 Win=0 Len=0
    203 3.934902       172.17.32.142         27.148.145.195        TCP      56084 → https(443) [SYN] Seq=0 Win=65535 Len=0 MSS=1460 WS=32 TSval=663689833 TSecr=0 SACK_PERM=1
    204 3.951428       27.148.145.195        172.17.32.142         TCP      https(443) → 56084 [SYN, ACK] Seq=0 Ack=1 Win=14600 Len=0 MSS=1460 SACK_PERM=1 WS=128
    205 3.951522       172.17.32.142         27.148.145.195        TCP      56084 → https(443) [ACK] Seq=1 Ack=1 Win=262144 Len=0
    206 3.954955       172.17.32.142         27.148.145.195        TLSv1.2  Client Hello
    207 3.964615       27.148.145.195        172.17.32.142         TLSv1.2  Server Hello, Change Cipher Spec, Encrypted Handshake Message
    208 3.964686       172.17.32.142         27.148.145.195        TCP      56084 → https(443) [ACK] Seq=518 Ack=142 Win=261984 Len=0
    209 3.965500       172.17.32.142         27.148.145.195        TLSv1.2  Change Cipher Spec, Hello Request, Hello Request
    210 3.972985       27.148.145.195        172.17.32.142         TCP      https(443) → 56084 [ACK] Seq=1 Ack=518 Win=15744 Len=0
    211 3.973027       172.17.32.142         27.148.145.195        TLSv1.2  Application Data
    212 3.994536       27.148.145.195        172.17.32.142         TCP      https(443) → 56084 [ACK] Seq=142 Ack=711 Win=16768 Len=0
    213 4.027594       27.148.145.195        172.17.32.142         TLSv1.2  Application Data
    214 4.027662       172.17.32.142         27.148.145.195        TCP      56084 → https(443) [ACK] Seq=711 Ack=515 Win=261760 Len=0
    215 4.028836       27.148.145.195        172.17.32.142         TLSv1.2  Application Data
    216 4.029074       172.17.32.142         27.148.145.195        TCP      56084 → https(443) [ACK] Seq=711 Ack=616 Win=262016 Len=0
    217 4.029260       27.148.145.195        172.17.32.142         TLSv1.2  Encrypted Alert
    218 4.029345       172.17.32.142         27.148.145.195        TCP      56084 → https(443) [ACK] Seq=711 Ack=647 Win=261984 Len=0
    219 4.031052       27.148.145.195        172.17.32.142         TCP      https(443) → 56084 [FIN, ACK] Seq=647 Ack=711 Win=16768 Len=0
    220 4.031221       172.17.32.142         27.148.145.195        TCP      56084 → https(443) [ACK] Seq=711 Ack=648 Win=262144 Len=0
    221 4.053288       172.17.32.142         27.148.145.195        TLSv1.2  Encrypted Alert
    222 4.056151       172.17.32.142         27.148.145.195        TCP      56084 → https(443) [FIN, ACK] Seq=742 Ack=648 Win=262144 Len=0
    223 4.065972       27.148.145.195        172.17.32.142         TCP      https(443) → 56084 [RST] Seq=648 Win=0 Len=0
    224 4.075999       27.148.145.195        172.17.32.142         TCP      https(443) → 56084 [RST] Seq=648 Win=0 Len=0
    225 4.360322       172.17.32.142         106.122.254.22        TCP      56085 → https(443) [SYN, ECN, CWR] Seq=0 Win=65535 Len=0 MSS=1460 WS=32 TSval=663690251 TSecr=0 SACK_PERM=1
    226 4.377072       106.122.254.22        172.17.32.142         TCP      https(443) → 56085 [SYN, ACK, ECN] Seq=0 Ack=1 Win=65535 Len=0 MSS=1460 SACK_PERM=1 WS=128
    227 4.377178       172.17.32.142         106.122.254.22        TCP      56085 → https(443) [ACK] Seq=1 Ack=1 Win=262144 Len=0
    228 4.379768       172.17.32.142         106.122.254.22        TLSv1.2  Client Hello
    229 4.391088       106.122.254.22        172.17.32.142         TLSv1.2  Server Hello, Change Cipher Spec, Encrypted Handshake Message
    230 4.391178       172.17.32.142         106.122.254.22        TCP      56085 → https(443) [ACK] Seq=518 Ack=138 Win=261984 Len=0
    231 4.392336       172.17.32.142         106.122.254.22        TLSv1.2  Change Cipher Spec, Hello Request, Hello Request
    232 4.399135       106.122.254.22        172.17.32.142         TCP      https(443) → 56085 [ACK] Seq=1 Ack=518 Win=176768 Len=0
    233 4.399203       172.17.32.142         106.122.254.22        TLSv1.2  Application Data
    234 4.415730       106.122.254.22        172.17.32.142         TCP      https(443) → 56085 [ACK] Seq=138 Ack=711 Win=182528 Len=0
    235 4.467777       106.122.254.22        172.17.32.142         TLSv1.2  Application Data
    236 4.467856       172.17.32.142         106.122.254.22        TCP      56085 → https(443) [ACK] Seq=711 Ack=512 Win=261760 Len=0
    237 4.470479       106.122.254.22        172.17.32.142         TLSv1.2  Application Data
    238 4.470540       172.17.32.142         106.122.254.22        TCP      56085 → https(443) [ACK] Seq=711 Ack=613 Win=262016 Len=0
    239 4.471598       106.122.254.22        172.17.32.142         TLSv1.2  Encrypted Alert
    240 4.471680       172.17.32.142         106.122.254.22        TCP      56085 → https(443) [ACK] Seq=711 Ack=644 Win=262112 Len=0
    241 4.472892       106.122.254.22        172.17.32.142         TCP      https(443) → 56085 [FIN, ACK] Seq=644 Ack=711 Win=182528 Len=0
    242 4.472931       172.17.32.142         106.122.254.22        TCP      56085 → https(443) [ACK] Seq=711 Ack=645 Win=262144 Len=0
    243 4.475483       172.17.32.142         106.122.254.22        TLSv1.2  Encrypted Alert
    244 4.476234       172.17.32.142         106.122.254.22        TCP      56085 → https(443) [FIN, ACK] Seq=742 Ack=645 Win=262144 Len=0
    245 4.491332       106.122.254.22        172.17.32.142         TCP      https(443) → 56085 [RST] Seq=645 Win=0 Len=0
    246 4.781643       172.17.32.142         27.148.145.195        TCP      56087 → https(443) [SYN, ECN, CWR] Seq=0 Win=65535 Len=0 MSS=1460 WS=32 TSval=663690661 TSecr=0 SACK_PERM=1
    247 4.798552       27.148.145.195        172.17.32.142         TCP      https(443) → 56087 [SYN, ACK, ECN] Seq=0 Ack=1 Win=14600 Len=0 MSS=1460 SACK_PERM=1 WS=128
    248 4.798619       172.17.32.142         27.148.145.195        TCP      56087 → https(443) [ACK] Seq=1 Ack=1 Win=262144 Len=0
    249 4.800241       172.17.32.142         27.148.145.195        TLSv1.2  Client Hello
    250 4.808384       27.148.145.195        172.17.32.142         TLSv1.2  Server Hello, Change Cipher Spec, Encrypted Handshake Message
    251 4.808464       172.17.32.142         27.148.145.195        TCP      56087 → https(443) [ACK] Seq=518 Ack=142 Win=261984 Len=0
    252 4.809369       172.17.32.142         27.148.145.195        TLSv1.2  Change Cipher Spec, Hello Request, Hello Request
    253 4.815910       27.148.145.195        172.17.32.142         TCP      https(443) → 56087 [ACK] Seq=1 Ack=518 Win=15744 Len=0
    254 4.815976       172.17.32.142         27.148.145.195        TLSv1.2  Application Data
    255 4.831980       27.148.145.195        172.17.32.142         TCP      https(443) → 56087 [ACK] Seq=142 Ack=711 Win=16768 Len=0
    256 4.870052       27.148.145.195        172.17.32.142         TLSv1.2  Application Data
    257 4.870144       172.17.32.142         27.148.145.195        TCP      56087 → https(443) [ACK] Seq=711 Ack=515 Win=261760 Len=0
    258 4.870735       27.148.145.195        172.17.32.142         TLSv1.2  Application Data
    259 4.870809       172.17.32.142         27.148.145.195        TCP      56087 → https(443) [ACK] Seq=711 Ack=616 Win=262016 Len=0
    260 4.871579       27.148.145.195        172.17.32.142         TLSv1.2  Encrypted Alert
    261 4.871659       172.17.32.142         27.148.145.195        TCP      56087 → https(443) [ACK] Seq=711 Ack=647 Win=262112 Len=0
    262 4.872839       27.148.145.195        172.17.32.142         TCP      https(443) → 56087 [FIN, ACK] Seq=647 Ack=711 Win=16768 Len=0
    263 4.872916       172.17.32.142         27.148.145.195        TCP      56087 → https(443) [ACK] Seq=711 Ack=648 Win=262144 Len=0
    264 4.877829       172.17.32.142         27.148.145.195        TLSv1.2  Encrypted Alert
    265 4.878283       172.17.32.142         27.148.145.195        TCP      56087 → https(443) [FIN, ACK] Seq=742 Ack=648 Win=262144 Len=0
    266 4.886361       27.148.145.195        172.17.32.142         TCP      https(443) → 56087 [RST] Seq=648 Win=0 Len=0
    267 4.894259       27.148.145.195        172.17.32.142         TCP      https(443) → 56087 [RST] Seq=648 Win=0 Len=0
    268 5.183317       172.17.32.142         106.122.254.22        TCP      56088 → https(443) [SYN] Seq=0 Win=65535 Len=0 MSS=1460 WS=32 TSval=663691056 TSecr=0 SACK_PERM=1
    269 5.200847       106.122.254.22        172.17.32.142         TCP      https(443) → 56088 [SYN, ACK] Seq=0 Ack=1 Win=65535 Len=0 MSS=1460 SACK_PERM=1 WS=128
    270 5.200945       172.17.32.142         106.122.254.22        TCP      56088 → https(443) [ACK] Seq=1 Ack=1 Win=262144 Len=0
    271 5.203474       172.17.32.142         106.122.254.22        TLSv1.2  Client Hello
    272 5.218281       106.122.254.22        172.17.32.142         TCP      https(443) → 56088 [ACK] Seq=1 Ack=518 Win=176768 Len=0
    273 5.229229       106.122.254.22        172.17.32.142         TLSv1.2  Server Hello, Change Cipher Spec, Encrypted Handshake Message
    274 5.229308       172.17.32.142         106.122.254.22        TCP      56088 → https(443) [ACK] Seq=518 Ack=138 Win=261984 Len=0
    275 5.230681       172.17.32.142         106.122.254.22        TLSv1.2  Change Cipher Spec, Hello Request, Hello Request
    276 5.239601       106.122.254.22        172.17.32.142         TLSv1.2  [TCP Spurious Retransmission] , Server Hello, Change Cipher Spec, Encrypted Handshake Message
    277 5.239664       172.17.32.142         106.122.254.22        TLSv1.2  Application Data
    278 5.286177       106.122.254.22        172.17.32.142         TCP      https(443) → 56088 [ACK] Seq=138 Ack=569 Win=176768 Len=0
    279 5.308164       172.17.32.142         106.122.254.22        TCP      [TCP Retransmission] 56088 → https(443) [PSH, ACK] Seq=569 Ack=138 Win=262144 Len=142
    280 5.327252       106.122.254.22        172.17.32.142         TCP      https(443) → 56088 [ACK] Seq=138 Ack=711 Win=182528 Len=0
    281 5.728061       106.122.254.22        172.17.32.142         TLSv1.2  Application Data
    282 5.728135       172.17.32.142         106.122.254.22        TCP      56088 → https(443) [ACK] Seq=711 Ack=512 Win=261760 Len=0
    283 5.729601       106.122.254.22        172.17.32.142         TLSv1.2  Application Data
    284 5.729668       172.17.32.142         106.122.254.22        TCP      56088 → https(443) [ACK] Seq=711 Ack=613 Win=262016 Len=0
    285 5.729759       106.122.254.22        172.17.32.142         TLSv1.2  Encrypted Alert
    286 5.729800       172.17.32.142         106.122.254.22        TCP      56088 → https(443) [ACK] Seq=711 Ack=644 Win=262112 Len=0
    287 5.731980       106.122.254.22        172.17.32.142         TCP      https(443) → 56088 [FIN, ACK] Seq=644 Ack=711 Win=182528 Len=0
    288 5.732046       172.17.32.142         106.122.254.22        TCP      56088 → https(443) [ACK] Seq=711 Ack=645 Win=262144 Len=0
    289 5.735059       172.17.32.142         106.122.254.22        TLSv1.2  Encrypted Alert
    290 5.735851       172.17.32.142         106.122.254.22        TCP      56088 → https(443) [FIN, ACK] Seq=742 Ack=645 Win=262144 Len=0
    291 5.739019       106.122.254.22        172.17.32.142         TCP      [TCP Out-Of-Order] https(443) → 56088 [PSH, ACK] Seq=613 Ack=711 Win=182528 Len=31
    292 5.739220       172.17.32.142         106.122.254.22        TCP      [TCP Out-Of-Order] 56088 → https(443) [FIN, ACK] Seq=742 Ack=645 Win=262144 Len=0 SLE=613 SRE=644
    293 5.742096       106.122.254.22        172.17.32.142         TCP      [TCP Out-Of-Order] https(443) → 56088 [PSH, ACK] Seq=613 Ack=711 Win=182528 Len=31
    294 5.742195       172.17.32.142         106.122.254.22        TCP      [TCP Out-Of-Order] 56088 → https(443) [FIN, ACK] Seq=742 Ack=645 Win=262144 Len=0 SLE=613 SRE=644
    295 5.746900       106.122.254.22        172.17.32.142         TCP      https(443) → 56088 [RST] Seq=645 Win=0 Len=0
    296 5.754662       106.122.254.22        172.17.32.142         TCP      https(443) → 56088 [RST] Seq=645 Win=0 Len=0
    297 5.765187       106.122.254.22        172.17.32.142         TCP      https(443) → 56088 [RST] Seq=645 Win=0 Len=0
    298 6.039676       172.17.32.142         27.148.145.195        TCP      56089 → https(443) [SYN] Seq=0 Win=65535 Len=0 MSS=1460 WS=32 TSval=663691900 TSecr=0 SACK_PERM=1
    299 6.055275       27.148.145.195        172.17.32.142         TCP      https(443) → 56089 [SYN, ACK] Seq=0 Ack=1 Win=14600 Len=0 MSS=1460 SACK_PERM=1 WS=128
    300 6.055489       172.17.32.142         27.148.145.195        TCP      56089 → https(443) [ACK] Seq=1 Ack=1 Win=262144 Len=0
    301 6.059779       172.17.32.142         27.148.145.195        TLSv1.2  Client Hello
    302 6.069038       27.148.145.195        172.17.32.142         TLSv1.2  Server Hello, Change Cipher Spec, Encrypted Handshake Message
    303 6.069115       172.17.32.142         27.148.145.195        TCP      56089 → https(443) [ACK] Seq=518 Ack=142 Win=261984 Len=0
    304 6.070657       172.17.32.142         27.148.145.195        TLSv1.2  Change Cipher Spec, Hello Request, Hello Request
    305 6.076886       27.148.145.195        172.17.32.142         TCP      https(443) → 56089 [ACK] Seq=1 Ack=518 Win=15744 Len=0
    306 6.076928       172.17.32.142         27.148.145.195        TLSv1.2  Application Data
    307 6.096049       27.148.145.195        172.17.32.142         TCP      https(443) → 56089 [ACK] Seq=142 Ack=711 Win=16768 Len=0
    308 6.141394       27.148.145.195        172.17.32.142         TLSv1.2  Application Data
    309 6.141446       172.17.32.142         27.148.145.195        TCP      56089 → https(443) [ACK] Seq=711 Ack=515 Win=261760 Len=0
    310 6.141902       27.148.145.195        172.17.32.142         TLSv1.2  Application Data
    311 6.141935       172.17.32.142         27.148.145.195        TCP      56089 → https(443) [ACK] Seq=711 Ack=616 Win=262016 Len=0
    312 6.142591       27.148.145.195        172.17.32.142         TLSv1.2  Encrypted Alert
