No.     Time           Source                Destination           Protocol Length Info
      1 0.000000       172.16.20.51          120.24.48.119         TCP      74     45363 → sgcp(440) [SYN] Seq=0 Win=65535 Len=0 MSS=1460 SACK_PERM=1 TSval=20267851 TSecr=0 WS=64
      2 0.018339       120.24.48.119         172.16.20.51          TCP      74     sgcp(440) → 45363 [SYN, ACK] Seq=0 Ack=1 Win=28960 Len=0 MSS=1460 SACK_PERM=1 TSval=3846219564 TSecr=20267851 WS=128
      3 0.021447       172.16.20.51          120.24.48.119         TCP      66     45363 → sgcp(440) [ACK] Seq=1 Ack=1 Win=87616 Len=0 TSval=20267853 TSecr=3846219564
      4 0.024186       172.16.20.51          120.24.48.119         TLSv1.2  288    Client Hello
      5 0.042959       120.24.48.119         172.16.20.51          TCP      66     sgcp(440) → 45363 [ACK] Seq=1 Ack=223 Win=30080 Len=0 TSval=3846219588 TSecr=20267853
      6 0.045198       120.24.48.119         172.16.20.51          TLSv1.2  1514   Server Hello, Certificate
      7 0.045201       120.24.48.119         172.16.20.51          TLSv1.2  351    Server Key Exchange, Server Hello Done
      8 0.061325       172.16.20.51          120.24.48.119         TCP      66     45363 → sgcp(440) [ACK] Seq=223 Ack=1449 Win=90496 Len=0 TSval=20267857 TSecr=3846219589
      9 0.062391       172.16.20.51          120.24.48.119         TCP      66     45363 → sgcp(440) [ACK] Seq=223 Ack=1734 Win=93440 Len=0 TSval=20267857 TSecr=3846219589
     10 0.072341       172.16.20.51          120.24.48.119         TLSv1.2  192    Client Key Exchange, Change Cipher Spec, Encrypted Handshake Message
     11 0.090923       120.24.48.119         172.16.20.51          TLSv1.2  117    Change Cipher Spec, Encrypted Handshake Message
     12 0.096252       172.16.20.51          120.24.48.119         TLSv1.2  218    Application Data
     13 0.115285       120.24.48.119         172.16.20.51          TLSv1.2  940    Application Data
     14 0.115301       120.24.48.119         172.16.20.51          TLSv1.2  97     Encrypted Alert
     15 0.120076       172.16.20.51          120.24.48.119         TLSv1.2  97     Encrypted Alert
     16 0.120108       172.16.20.51          120.24.48.119         TCP      66     45363 → sgcp(440) [RST, ACK] Seq=532 Ack=2691 Win=96320 Len=0 TSval=20267863 TSecr=3846219660
     17 0.401495       172.16.20.51          120.24.48.119         TCP      74     41336 → sgcp(440) [SYN] Seq=0 Win=65535 Len=0 MSS=1460 SACK_PERM=1 TSval=20267891 TSecr=0 WS=64
     18 0.419981       120.24.48.119         172.16.20.51          TCP      74     sgcp(440) → 41336 [SYN, ACK] Seq=0 Ack=1 Win=28960 Len=0 MSS=1460 SACK_PERM=1 TSval=3846219970 TSecr=20267891 WS=128
     19 0.421401       172.16.20.51          120.24.48.119         TCP      66     41336 → sgcp(440) [ACK] Seq=1 Ack=1 Win=87616 Len=0 TSval=20267893 TSecr=3846219970
     20 0.423197       172.16.20.51          120.24.48.119         TLSv1.2  288    Client Hello
     21 0.441884       120.24.48.119         172.16.20.51          TCP      66     sgcp(440) → 41336 [ACK] Seq=1 Ack=223 Win=30080 Len=0 TSval=3846219992 TSecr=20267893
     22 0.444036       120.24.48.119         172.16.20.51          TLSv1.2  1514   Server Hello, Certificate
     23 0.444039       120.24.48.119         172.16.20.51          TLSv1.2  351    Server Key Exchange, Server Hello Done
     24 0.445453       172.16.20.51          120.24.48.119         TCP      66     41336 → sgcp(440) [ACK] Seq=223 Ack=1449 Win=90496 Len=0 TSval=20267896 TSecr=3846219994
     25 0.445461       172.16.20.51          120.24.48.119         TCP      66     41336 → sgcp(440) [ACK] Seq=223 Ack=1734 Win=93440 Len=0 TSval=20267896 TSecr=3846219994
     26 0.456387       172.16.20.51          120.24.48.119         TLSv1.2  192    Client Key Exchange, Change Cipher Spec, Encrypted Handshake Message
     27 0.476026       120.24.48.119         172.16.20.51          TLSv1.2  117    Change Cipher Spec, Encrypted Handshake Message
     28 0.486615       172.16.20.51          120.24.48.119         TLSv1.2  218    Application Data
     29 0.505992       120.24.48.119         172.16.20.51          TLSv1.2  940    Application Data
     30 0.505994       120.24.48.119         172.16.20.51          TLSv1.2  97     Encrypted Alert
     31 0.507810       172.16.20.51          120.24.48.119         TLSv1.2  97     Encrypted Alert
     32 0.508292       172.16.20.51          120.24.48.119         TCP      66     41336 → sgcp(440) [RST, ACK] Seq=532 Ack=2691 Win=96320 Len=0 TSval=20267902 TSecr=3846220056
     33 0.794777       172.16.20.51          120.24.48.119         TCP      74     36115 → sgcp(440) [SYN] Seq=0 Win=65535 Len=0 MSS=1460 SACK_PERM=1 TSval=20267930 TSecr=0 WS=64
     34 0.819053       120.24.48.119         172.16.20.51          TCP      74     sgcp(440) → 36115 [SYN, ACK] Seq=0 Ack=1 Win=28960 Len=0 MSS=1460 SACK_PERM=1 TSval=3846220364 TSecr=20267930 WS=128
     35 0.820655       172.16.20.51          120.24.48.119         TCP      66     36115 → sgcp(440) [ACK] Seq=1 Ack=1 Win=87616 Len=0 TSval=20267933 TSecr=3846220364
     36 0.828535       172.16.20.51          120.24.48.119         TLSv1.2  288    Client Hello
     37 0.852994       120.24.48.119         172.16.20.51          TCP      66     sgcp(440) → 36115 [ACK] Seq=1 Ack=223 Win=30080 Len=0 TSval=3846220397 TSecr=20267933
     38 0.854976       120.24.48.119         172.16.20.51          TLSv1.2  1514   Server Hello, Certificate
     39 0.854987       120.24.48.119         172.16.20.51          TLSv1.2  351    Server Key Exchange, Server Hello Done
     40 0.865956       172.16.20.51          120.24.48.119         TCP      66     36115 → sgcp(440) [ACK] Seq=223 Ack=1449 Win=90496 Len=0 TSval=20267937 TSecr=3846220399
     41 0.866847       172.16.20.51          120.24.48.119         TCP      66     36115 → sgcp(440) [ACK] Seq=223 Ack=1734 Win=93440 Len=0 TSval=20267938 TSecr=3846220399
     42 0.890683       172.16.20.51          120.24.48.119         TLSv1.2  192    Client Key Exchange, Change Cipher Spec, Encrypted Handshake Message
     43 0.915950       120.24.48.119         172.16.20.51          TLSv1.2  117    Change Cipher Spec, Encrypted Handshake Message
     44 0.921542       172.16.20.51          120.24.48.119         TLSv1.2  218    Application Data
     45 0.945970       120.24.48.119         172.16.20.51          TLSv1.2  940    Application Data
     46 0.945975       120.24.48.119         172.16.20.51          TLSv1.2  97     Encrypted Alert
     47 0.948767       172.16.20.51          120.24.48.119         TLSv1.2  97     Encrypted Alert
     48 0.948772       172.16.20.51          120.24.48.119         TCP      66     36115 → sgcp(440) [RST, ACK] Seq=532 Ack=2691 Win=96320 Len=0 TSval=20267946 TSecr=3846220490
     49 1.217179       172.16.20.51          120.24.48.119         TCP      74     38151 → sgcp(440) [SYN] Seq=0 Win=65535 Len=0 MSS=1460 SACK_PERM=1 TSval=20267973 TSecr=0 WS=64
     50 1.236184       120.24.48.119         172.16.20.51          TCP      74     sgcp(440) → 38151 [SYN, ACK] Seq=0 Ack=1 Win=28960 Len=0 MSS=1460 SACK_PERM=1 TSval=3846220782 TSecr=20267973 WS=128
     51 1.237682       172.16.20.51          120.24.48.119         TCP      66     38151 → sgcp(440) [ACK] Seq=1 Ack=1 Win=87616 Len=0 TSval=20267975 TSecr=3846220782
     52 1.239321       172.16.20.51          120.24.48.119         TLSv1.2  288    Client Hello
     53 1.259693       120.24.48.119         172.16.20.51          TCP      66     sgcp(440) → 38151 [ACK] Seq=1 Ack=223 Win=30080 Len=0 TSval=3846220804 TSecr=20267975
     54 1.260941       120.24.48.119         172.16.20.51          TLSv1.2  1514   Server Hello, Certificate
     55 1.260944       120.24.48.119         172.16.20.51          TLSv1.2  351    Server Key Exchange, Server Hello Done
     56 1.262277       172.16.20.51          120.24.48.119         TCP      66     38151 → sgcp(440) [ACK] Seq=223 Ack=1449 Win=90496 Len=0 TSval=20267977 TSecr=3846220805
     57 1.262282       172.16.20.51          120.24.48.119         TCP      66     38151 → sgcp(440) [ACK] Seq=223 Ack=1734 Win=93440 Len=0 TSval=20267977 TSecr=3846220805
     58 1.273196       172.16.20.51          120.24.48.119         TLSv1.2  192    Client Key Exchange, Change Cipher Spec, Encrypted Handshake Message
     59 1.293730       120.24.48.119         172.16.20.51          TLSv1.2  117    Change Cipher Spec, Encrypted Handshake Message
     60 1.306987       172.16.20.51          120.24.48.119         TLSv1.2  218    Application Data
     61 1.325975       120.24.48.119         172.16.20.51          TLSv1.2  940    Application Data
     62 1.327142       120.24.48.119         172.16.20.51          TLSv1.2  97     Encrypted Alert
     63 1.339637       172.16.20.51          120.24.48.119         TLSv1.2  97     Encrypted Alert
     64 1.340095       172.16.20.51          120.24.48.119         TCP      66     38151 → sgcp(440) [RST, ACK] Seq=532 Ack=2691 Win=96320 Len=0 TSval=20267985 TSecr=3846220871
     65 1.605328       172.16.20.51          120.24.48.119         TCP      74     34063 → sgcp(440) [SYN] Seq=0 Win=65535 Len=0 MSS=1460 SACK_PERM=1 TSval=20268011 TSecr=0 WS=64
     66 1.623919       120.24.48.119         172.16.20.51          TCP      74     sgcp(440) → 34063 [SYN, ACK] Seq=0 Ack=1 Win=28960 Len=0 MSS=1460 SACK_PERM=1 TSval=3846221174 TSecr=20268011 WS=128
     67 1.625919       172.16.20.51          120.24.48.119         TCP      66     34063 → sgcp(440) [ACK] Seq=1 Ack=1 Win=87616 Len=0 TSval=20268014 TSecr=3846221174
     68 1.627760       172.16.20.51          120.24.48.119         TLSv1.2  288    Client Hello
     69 1.646994       120.24.48.119         172.16.20.51          TCP      66     sgcp(440) → 34063 [ACK] Seq=1 Ack=223 Win=30080 Len=0 TSval=3846221196 TSecr=20268014
     70 1.648908       120.24.48.119         172.16.20.51          TLSv1.2  1514   Server Hello, Certificate
     71 1.648911       120.24.48.119         172.16.20.51          TLSv1.2  351    Server Key Exchange, Server Hello Done
     72 1.652144       172.16.20.51          120.24.48.119         TCP      66     34063 → sgcp(440) [ACK] Seq=223 Ack=1449 Win=90496 Len=0 TSval=20268016 TSecr=3846221198
     73 1.652149       172.16.20.51          120.24.48.119         TCP      66     34063 → sgcp(440) [ACK] Seq=223 Ack=1734 Win=93440 Len=0 TSval=20268016 TSecr=3846221198
     74 1.686317       172.16.20.51          120.24.48.119         TLSv1.2  192    Client Key Exchange, Change Cipher Spec, Encrypted Handshake Message
     75 1.706199       120.24.48.119         172.16.20.51          TLSv1.2  117    Change Cipher Spec, Encrypted Handshake Message
     76 1.714731       172.16.20.51          120.24.48.119         TCP      66     34063 → sgcp(440) [ACK] Seq=349 Ack=1785 Win=93440 Len=0 TSval=20268023 TSecr=3846221255
     77 1.716318       172.16.20.51          120.24.48.119         TLSv1.2  218    Application Data
     78 1.736194       120.24.48.119         172.16.20.51          TLSv1.2  940    Application Data
     79 1.736200       120.24.48.119         172.16.20.51          TLSv1.2  97     Encrypted Alert
     80 1.751456       172.16.20.51          120.24.48.119         TLSv1.2  97     Encrypted Alert
     81 1.752755       172.16.20.51          120.24.48.119         TCP      66     34063 → sgcp(440) [RST, ACK] Seq=532 Ack=2691 Win=96320 Len=0 TSval=20268026 TSecr=3846221285
     82 2.136960       172.16.20.51          120.24.48.119         TCP      74     47635 → sgcp(440) [SYN] Seq=0 Win=65535 Len=0 MSS=1460 SACK_PERM=1 TSval=20268065 TSecr=0 WS=64
     83 2.160508       120.24.48.119         172.16.20.51          TCP      74     sgcp(440) → 47635 [SYN, ACK] Seq=0 Ack=1 Win=28960 Len=0 MSS=1460 SACK_PERM=1 TSval=3846221706 TSecr=20268065 WS=128
     84 2.161857       172.16.20.51          120.24.48.119         TCP      66     47635 → sgcp(440) [ACK] Seq=1 Ack=1 Win=87616 Len=0 TSval=20268067 TSecr=3846221706
     85 2.167730       172.16.20.51          120.24.48.119         TLSv1.2  288    Client Hello
     86 2.192971       120.24.48.119         172.16.20.51          TCP      66     sgcp(440) → 47635 [ACK] Seq=1 Ack=223 Win=30080 Len=0 TSval=3846221737 TSecr=20268067
     87 2.194995       120.24.48.119         172.16.20.51          TLSv1.2  1514   Server Hello, Certificate
     88 2.194997       120.24.48.119         172.16.20.51          TLSv1.2  351    Server Key Exchange, Server Hello Done
     89 2.196366       172.16.20.51          120.24.48.119         TCP      66     47635 → sgcp(440) [ACK] Seq=223 Ack=1449 Win=90496 Len=0 TSval=20268071 TSecr=3846221738
     90 2.196371       172.16.20.51          120.24.48.119         TCP      66     47635 → sgcp(440) [ACK] Seq=223 Ack=1734 Win=93440 Len=0 TSval=20268071 TSecr=3846221738
     91 2.247429       172.16.20.51          120.24.48.119         TLSv1.2  192    Client Key Exchange, Change Cipher Spec, Encrypted Handshake Message
     92 2.272126       120.24.48.119         172.16.20.51          TLSv1.2  117    Change Cipher Spec, Encrypted Handshake Message
     93 2.273262       172.16.20.51          120.24.48.119         TCP      66     47635 → sgcp(440) [ACK] Seq=349 Ack=1785 Win=93440 Len=0 TSval=20268078 TSecr=3846221817
     94 2.276219       172.16.20.51          120.24.48.119         TLSv1.2  218    Application Data
     95 2.302249       120.24.48.119         172.16.20.51          TLSv1.2  940    Application Data
     96 2.302260       120.24.48.119         172.16.20.51          TLSv1.2  97     Encrypted Alert
     97 2.320001       172.16.20.51          120.24.48.119         TLSv1.2  97     Encrypted Alert
     98 2.320002       172.16.20.51          120.24.48.119         TCP      66     47635 → sgcp(440) [RST, ACK] Seq=532 Ack=2691 Win=96320 Len=0 TSval=20268083 TSecr=3846221845
     99 2.717560       172.16.20.51          120.24.48.119         TCP      74     44640 → sgcp(440) [SYN] Seq=0 Win=65535 Len=0 MSS=1460 SACK_PERM=1 TSval=20268122 TSecr=0 WS=64
    100 2.735110       120.24.48.119         172.16.20.51          TCP      74     sgcp(440) → 44640 [SYN, ACK] Seq=0 Ack=1 Win=28960 Len=0 MSS=1460 SACK_PERM=1 TSval=3846222286 TSecr=20268122 WS=128
    101 2.739324       172.16.20.51          120.24.48.119         TCP      66     44640 → sgcp(440) [ACK] Seq=1 Ack=1 Win=87616 Len=0 TSval=20268125 TSecr=3846222286
    102 2.771633       172.16.20.51          120.24.48.119         TLSv1.2  288    Client Hello
    103 2.790979       120.24.48.119         172.16.20.51          TCP      66     sgcp(440) → 44640 [ACK] Seq=1 Ack=223 Win=30080 Len=0 TSval=3846222340 TSecr=20268128
    104 2.792533       120.24.48.119         172.16.20.51          TLSv1.2  1514   Server Hello, Certificate
    105 2.792537       120.24.48.119         172.16.20.51          TLSv1.2  351    Server Key Exchange, Server Hello Done
    106 2.794009       172.16.20.51          120.24.48.119         TCP      66     44640 → sgcp(440) [ACK] Seq=223 Ack=1449 Win=90496 Len=0 TSval=20268130 TSecr=3846222342
    107 2.794011       172.16.20.51          120.24.48.119         TCP      66     44640 → sgcp(440) [ACK] Seq=223 Ack=1734 Win=93440 Len=0 TSval=20268130 TSecr=3846222342
    108 2.837662       172.16.20.51          120.24.48.119         TLSv1.2  192    Client Key Exchange, Change Cipher Spec, Encrypted Handshake Message
    109 2.856006       120.24.48.119         172.16.20.51          TLSv1.2  117    Change Cipher Spec, Encrypted Handshake Message
    110 2.857205       172.16.20.51          120.24.48.119         TCP      66     44640 → sgcp(440) [ACK] Seq=349 Ack=1785 Win=93440 Len=0 TSval=20268137 TSecr=3846222407
    111 2.859223       172.16.20.51          120.24.48.119         TLSv1.2  218    Application Data
    112 2.877971       120.24.48.119         172.16.20.51          TLSv1.2  940    Application Data
    113 2.877973       120.24.48.119         172.16.20.51          TLSv1.2  97     Encrypted Alert
    114 2.880778       172.16.20.51          120.24.48.119         TLSv1.2  97     Encrypted Alert
    115 2.880779       172.16.20.51          120.24.48.119         TCP      66     44640 → sgcp(440) [RST, ACK] Seq=532 Ack=2691 Win=96320 Len=0 TSval=20268139 TSecr=3846222428
    116 3.196761       172.16.20.51          120.24.48.119         TCP      74     46154 → sgcp(440) [SYN] Seq=0 Win=65535 Len=0 MSS=1460 SACK_PERM=1 TSval=20268171 TSecr=0 WS=64
    117 3.220272       120.24.48.119         172.16.20.51          TCP      74     sgcp(440) → 46154 [SYN, ACK] Seq=0 Ack=1 Win=28960 Len=0 MSS=1460 SACK_PERM=1 TSval=3846222766 TSecr=20268171 WS=128
    118 3.221859       172.16.20.51          120.24.48.119         TCP      66     46154 → sgcp(440) [ACK] Seq=1 Ack=1 Win=87616 Len=0 TSval=20268173 TSecr=3846222766
    119 3.236265       172.16.20.51          120.24.48.119         TLSv1.2  288    Client Hello
    120 3.260989       120.24.48.119         172.16.20.51          TCP      66     sgcp(440) → 46154 [ACK] Seq=1 Ack=223 Win=30080 Len=0 TSval=3846222806 TSecr=20268175
    121 3.264834       120.24.48.119         172.16.20.51          TLSv1.2  1514   Server Hello, Certificate
    122 3.264836       120.24.48.119         172.16.20.51          TLSv1.2  351    Server Key Exchange, Server Hello Done
    123 3.266469       172.16.20.51          120.24.48.119         TCP      66     46154 → sgcp(440) [ACK] Seq=223 Ack=1449 Win=90496 Len=0 TSval=20268178 TSecr=3846222808
    124 3.266622       172.16.20.51          120.24.48.119         TCP      66     46154 → sgcp(440) [ACK] Seq=223 Ack=1734 Win=93440 Len=0 TSval=20268178 TSecr=3846222808
    125 3.311484       172.16.20.51          120.24.48.119         TLSv1.2  192    Client Key Exchange, Change Cipher Spec, Encrypted Handshake Message
    126 3.335823       120.24.48.119         172.16.20.51          TLSv1.2  117    Change Cipher Spec, Encrypted Handshake Message
    127 3.336981       172.16.20.51          120.24.48.119         TCP      66     46154 → sgcp(440) [ACK] Seq=349 Ack=1785 Win=93440 Len=0 TSval=20268185 TSecr=3846222881
    128 3.343183       172.16.20.51          120.24.48.119         TLSv1.2  218    Application Data
    129 3.368289       120.24.48.119         172.16.20.51          TLSv1.2  940    Application Data
    130 3.368298       120.24.48.119         172.16.20.51          TLSv1.2  97     Encrypted Alert
    131 3.376325       172.16.20.51          120.24.48.119         TLSv1.2  97     Encrypted Alert
    132 3.376331       172.16.20.51          120.24.48.119         TCP      66     46154 → sgcp(440) [RST, ACK] Seq=532 Ack=2691 Win=96320 Len=0 TSval=20268188 TSecr=3846222912
    133 3.709391       172.16.20.51          120.24.48.119         TCP      74     42569 → sgcp(440) [SYN] Seq=0 Win=65535 Len=0 MSS=1460 SACK_PERM=1 TSval=20268222 TSecr=0 WS=64
    134 3.728263       120.24.48.119         172.16.20.51          TCP      74     sgcp(440) → 42569 [SYN, ACK] Seq=0 Ack=1 Win=28960 Len=0 MSS=1460 SACK_PERM=1 TSval=3846223274 TSecr=20268222 WS=128
    135 3.729548       172.16.20.51          120.24.48.119         TCP      66     42569 → sgcp(440) [ACK] Seq=1 Ack=1 Win=87616 Len=0 TSval=20268224 TSecr=3846223274
    136 3.733314       172.16.20.51          120.24.48.119         TLSv1.2  288    Client Hello
    137 3.752879       120.24.48.119         172.16.20.51          TCP      66     sgcp(440) → 42569 [ACK] Seq=1 Ack=223 Win=30080 Len=0 TSval=3846223298 TSecr=20268224
    138 3.754966       120.24.48.119         172.16.20.51          TLSv1.2  1514   Server Hello, Certificate
    139 3.754969       120.24.48.119         172.16.20.51          TLSv1.2  351    Server Key Exchange, Server Hello Done
    140 3.757342       172.16.20.51          120.24.48.119         TCP      66     42569 → sgcp(440) [ACK] Seq=223 Ack=1449 Win=90496 Len=0 TSval=20268227 TSecr=3846223300
    141 3.795772       172.16.20.51          120.24.48.119         TCP      66     42569 → sgcp(440) [ACK] Seq=223 Ack=1734 Win=93440 Len=0 TSval=20268228 TSecr=3846223300
    142 3.805924       172.16.20.51          120.24.48.119         TLSv1.2  192    Client Key Exchange, Change Cipher Spec, Encrypted Handshake Message
    143 3.826002       120.24.48.119         172.16.20.51          TLSv1.2  117    Change Cipher Spec, Encrypted Handshake Message
    144 3.855429       172.16.20.51          120.24.48.119         TLSv1.2  218    Application Data
    145 3.874860       120.24.48.119         172.16.20.51          TLSv1.2  940    Application Data
    146 3.874863       120.24.48.119         172.16.20.51          TLSv1.2  97     Encrypted Alert
    147 3.906221       172.16.20.51          120.24.48.119         TLSv1.2  97     Encrypted Alert
    148 3.914818       172.16.20.51          120.24.48.119         TCP      66     42569 → sgcp(440) [RST, ACK] Seq=532 Ack=2691 Win=96320 Len=0 TSval=20268242 TSecr=3846223420
    149 4.205415       172.16.20.51          120.24.48.119         TCP      74     33295 → sgcp(440) [SYN] Seq=0 Win=65535 Len=0 MSS=1460 SACK_PERM=1 TSval=20268271 TSecr=0 WS=64
    150 4.223240       120.24.48.119         172.16.20.51          TCP      74     sgcp(440) → 33295 [SYN, ACK] Seq=0 Ack=1 Win=28960 Len=0 MSS=1460 SACK_PERM=1 TSval=3846223769 TSecr=20268271 WS=128
    151 4.224639       172.16.20.51          120.24.48.119         TCP      66     33295 → sgcp(440) [ACK] Seq=1 Ack=1 Win=87616 Len=0 TSval=20268273 TSecr=3846223769
    152 4.227934       172.16.20.51          120.24.48.119         TLSv1.2  288    Client Hello
    153 4.245913       120.24.48.119         172.16.20.51          TCP      66     sgcp(440) → 33295 [ACK] Seq=1 Ack=223 Win=30080 Len=0 TSval=3846223791 TSecr=20268274
    154 4.248014       120.24.48.119         172.16.20.51          TLSv1.2  1514   Server Hello, Certificate
    155 4.248018       120.24.48.119         172.16.20.51          TLSv1.2  351    Server Key Exchange, Server Hello Done
    156 4.258369       172.16.20.51          120.24.48.119         TCP      66     33295 → sgcp(440) [ACK] Seq=223 Ack=1449 Win=90496 Len=0 TSval=20268277 TSecr=3846223793
    157 4.260156       172.16.20.51          120.24.48.119         TCP      66     33295 → sgcp(440) [ACK] Seq=223 Ack=1734 Win=93440 Len=0 TSval=20268277 TSecr=3846223793
    158 4.282483       172.16.20.51          120.24.48.119         TLSv1.2  192    Client Key Exchange, Change Cipher Spec, Encrypted Handshake Message
    159 4.301158       120.24.48.119         172.16.20.51          TLSv1.2  117    Change Cipher Spec, Encrypted Handshake Message
    160 4.327465       172.16.20.51          120.24.48.119         TLSv1.2  218    Application Data
    161 4.346123       120.24.48.119         172.16.20.51          TLSv1.2  940    Application Data
    162 4.346127       120.24.48.119         172.16.20.51          TLSv1.2  97     Encrypted Alert
    163 4.358430       172.16.20.51          120.24.48.119         TLSv1.2  97     Encrypted Alert
    164 4.358431       172.16.20.51          120.24.48.119         TCP      66     33295 → sgcp(440) [RST, ACK] Seq=532 Ack=2691 Win=96320 Len=0 TSval=20268286 TSecr=3846223891
    165 4.687137       172.16.20.51          120.24.48.119         TCP      74     34353 → sgcp(440) [SYN] Seq=0 Win=65535 Len=0 MSS=1460 SACK_PERM=1 TSval=20268320 TSecr=0 WS=64
    166 4.701411       120.24.48.119         172.16.20.51          TCP      74     sgcp(440) → 34353 [SYN, ACK] Seq=0 Ack=1 Win=28960 Len=0 MSS=1460 SACK_PERM=1 TSval=3846224251 TSecr=20268320 WS=128
    167 4.705403       172.16.20.51          120.24.48.119         TCP      66     34353 → sgcp(440) [ACK] Seq=1 Ack=1 Win=87616 Len=0 TSval=20268322 TSecr=3846224251
    168 4.724337       172.16.20.51          120.24.48.119         TLSv1.2  288    Client Hello
    169 4.739157       120.24.48.119         172.16.20.51          TCP      66     sgcp(440) → 34353 [ACK] Seq=1 Ack=223 Win=30080 Len=0 TSval=3846224288 TSecr=20268323
    170 4.740897       120.24.48.119         172.16.20.51          TLSv1.2  1514   Server Hello, Certificate
    171 4.740899       120.24.48.119         172.16.20.51          TLSv1.2  351    Server Key Exchange, Server Hello Done
    172 4.743427       172.16.20.51          120.24.48.119         TCP      66     34353 → sgcp(440) [ACK] Seq=223 Ack=1449 Win=90496 Len=0 TSval=20268325 TSecr=3846224289
    173 4.743428       172.16.20.51          120.24.48.119         TCP      66     34353 → sgcp(440) [ACK] Seq=223 Ack=1734 Win=93440 Len=0 TSval=20268325 TSecr=3846224289
    174 4.785885       172.16.20.51          120.24.48.119         TLSv1.2  192    Client Key Exchange, Change Cipher Spec, Encrypted Handshake Message
    175 4.800999       120.24.48.119         172.16.20.51          TLSv1.2  117    Change Cipher Spec, Encrypted Handshake Message
    176 4.804398       172.16.20.51          120.24.48.119         TCP      66     34353 → sgcp(440) [ACK] Seq=349 Ack=1785 Win=93440 Len=0 TSval=20268331 TSecr=3846224349
    177 4.819845       172.16.20.51          120.24.48.119         TLSv1.2  218    Application Data
    178 4.835004       120.24.48.119         172.16.20.51          TLSv1.2  940    Application Data
    179 4.835008       120.24.48.119         172.16.20.51          TLSv1.2  97     Encrypted Alert
    180 4.839488       172.16.20.51          120.24.48.119         TLSv1.2  97     Encrypted Alert
    181 4.842861       172.16.20.51          120.24.48.119         TCP      66     34353 → sgcp(440) [RST, ACK] Seq=532 Ack=2691 Win=96320 Len=0 TSval=20268335 TSecr=3846224383
    182 5.196850       172.16.20.51          120.24.48.119         TCP      74     40792 → sgcp(440) [SYN] Seq=0 Win=65535 Len=0 MSS=1460 SACK_PERM=1 TSval=20268371 TSecr=0 WS=64
    183 5.215062       120.24.48.119         172.16.20.51          TCP      74     sgcp(440) → 40792 [SYN, ACK] Seq=0 Ack=1 Win=28960 Len=0 MSS=1460 SACK_PERM=1 TSval=3846224760 TSecr=20268371 WS=128
    184 5.219188       172.16.20.51          120.24.48.119         TCP      66     40792 → sgcp(440) [ACK] Seq=1 Ack=1 Win=87616 Len=0 TSval=20268373 TSecr=3846224760
    185 5.235449       172.16.20.51          120.24.48.119         TLSv1.2  288    Client Hello
    186 5.253698       120.24.48.119         172.16.20.51          TCP      66     sgcp(440) → 40792 [ACK] Seq=1 Ack=223 Win=30080 Len=0 TSval=3846224799 TSecr=20268375
    187 5.256029       120.24.48.119         172.16.20.51          TLSv1.2  1514   Server Hello, Certificate
    188 5.256032       120.24.48.119         172.16.20.51          TLSv1.2  351    Server Key Exchange, Server Hello Done
    189 5.257861       172.16.20.51          120.24.48.119         TCP      66     40792 → sgcp(440) [ACK] Seq=223 Ack=1449 Win=90496 Len=0 TSval=20268377 TSecr=3846224800
    190 5.257868       172.16.20.51          120.24.48.119         TCP      66     40792 → sgcp(440) [ACK] Seq=223 Ack=1734 Win=93440 Len=0 TSval=20268377 TSecr=3846224800
    191 5.298995       172.16.20.51          120.24.48.119         TLSv1.2  192    Client Key Exchange, Change Cipher Spec, Encrypted Handshake Message
    192 5.317802       120.24.48.119         172.16.20.51          TLSv1.2  117    Change Cipher Spec, Encrypted Handshake Message
    193 5.320013       172.16.20.51          120.24.48.119         TCP      66     40792 → sgcp(440) [ACK] Seq=349 Ack=1785 Win=93440 Len=0 TSval=20268383 TSecr=3846224863
    194 5.326143       172.16.20.51          120.24.48.119         TLSv1.2  218    Application Data
    195 5.344747       120.24.48.119         172.16.20.51          TLSv1.2  940    Application Data
    196 5.344751       120.24.48.119         172.16.20.51          TLSv1.2  97     Encrypted Alert
    197 5.351176       172.16.20.51          120.24.48.119         TLSv1.2  97     Encrypted Alert
    198 5.358752       172.16.20.51          120.24.48.119         TCP      66     40792 → sgcp(440) [RST, ACK] Seq=532 Ack=2691 Win=96320 Len=0 TSval=20268387 TSecr=3846224889
    199 5.724090       172.16.20.51          120.24.48.119         TCP      74     43265 → sgcp(440) [SYN] Seq=0 Win=65535 Len=0 MSS=1460 SACK_PERM=1 TSval=20268423 TSecr=0 WS=64
    200 5.742590       120.24.48.119         172.16.20.51          TCP      74     sgcp(440) → 43265 [SYN, ACK] Seq=0 Ack=1 Win=28960 Len=0 MSS=1460 SACK_PERM=1 TSval=3846225288 TSecr=20268423 WS=128
    201 5.745970       172.16.20.51          120.24.48.119         TCP      66     43265 → sgcp(440) [ACK] Seq=1 Ack=1 Win=87616 Len=0 TSval=20268426 TSecr=3846225288
    202 5.770052       172.16.20.51          120.24.48.119         TLSv1.2  288    Client Hello
    203 5.789217       120.24.48.119         172.16.20.51          TCP      66     sgcp(440) → 43265 [ACK] Seq=1 Ack=223 Win=30080 Len=0 TSval=3846225334 TSecr=20268428
    204 5.791350       120.24.48.119         172.16.20.51          TLSv1.2  1514   Server Hello, Certificate
    205 5.791354       120.24.48.119         172.16.20.51          TLSv1.2  351    Server Key Exchange, Server Hello Done
    206 5.799291       172.16.20.51          120.24.48.119         TCP      66     43265 → sgcp(440) [ACK] Seq=223 Ack=1449 Win=90496 Len=0 TSval=20268431 TSecr=3846225336
    207 5.811772       172.16.20.51          120.24.48.119         TCP      66     43265 → sgcp(440) [ACK] Seq=223 Ack=1734 Win=93440 Len=0 TSval=20268432 TSecr=3846225336
    208 5.835147       172.16.20.51          120.24.48.119         TLSv1.2  192    Client Key Exchange, Change Cipher Spec, Encrypted Handshake Message
    209 5.854952       120.24.48.119         172.16.20.51          TLSv1.2  117    Change Cipher Spec, Encrypted Handshake Message
    210 5.861808       172.16.20.51          120.24.48.119         TLSv1.2  218    Application Data
    211 5.881558       120.24.48.119         172.16.20.51          TLSv1.2  940    Application Data
    212 5.881562       120.24.48.119         172.16.20.51          TLSv1.2  97     Encrypted Alert
    213 5.894277       172.16.20.51          120.24.48.119         TLSv1.2  97     Encrypted Alert
    214 5.898374       172.16.20.51          120.24.48.119         TCP      66     43265 → sgcp(440) [RST, ACK] Seq=532 Ack=2691 Win=96320 Len=0 TSval=20268441 TSecr=3846225426
    215 6.244235       172.16.20.51          120.24.48.119         TCP      74     45616 → sgcp(440) [SYN] Seq=0 Win=65535 Len=0 MSS=1460 SACK_PERM=1 TSval=20268475 TSecr=0 WS=64
    216 6.258385       120.24.48.119         172.16.20.51          TCP      74     sgcp(440) → 45616 [SYN, ACK] Seq=0 Ack=1 Win=28960 Len=0 MSS=1460 SACK_PERM=1 TSval=3846225808 TSecr=20268475 WS=128
    217 6.259842       172.16.20.51          120.24.48.119         TCP      66     45616 → sgcp(440) [ACK] Seq=1 Ack=1 Win=87616 Len=0 TSval=20268477 TSecr=3846225808
    218 6.280423       172.16.20.51          120.24.48.119         TLSv1.2  288    Client Hello
    219 6.295859       120.24.48.119         172.16.20.51          TCP      66     sgcp(440) → 45616 [ACK] Seq=1 Ack=223 Win=30080 Len=0 TSval=3846225845 TSecr=20268479
    220 6.296967       120.24.48.119         172.16.20.51          TLSv1.2  1514   Server Hello, Certificate
    221 6.296973       120.24.48.119         172.16.20.51          TLSv1.2  351    Server Key Exchange, Server Hello Done
    222 6.307437       172.16.20.51          120.24.48.119         TCP      66     45616 → sgcp(440) [ACK] Seq=223 Ack=1449 Win=90496 Len=0 TSval=20268482 TSecr=3846225846
    223 6.307783       172.16.20.51          120.24.48.119         TCP      66     45616 → sgcp(440) [ACK] Seq=223 Ack=1734 Win=93440 Len=0 TSval=20268482 TSecr=3846225846
    224 6.325000       172.16.20.51          120.24.48.119         TLSv1.2  192    Client Key Exchange, Change Cipher Spec, Encrypted Handshake Message
    225 6.340339       120.24.48.119         172.16.20.51          TLSv1.2  117    Change Cipher Spec, Encrypted Handshake Message
    226 6.349331       172.16.20.51          120.24.48.119         TLSv1.2  218    Application Data
    227 6.363710       120.24.48.119         172.16.20.51          TLSv1.2  940    Application Data
    228 6.363713       120.24.48.119         172.16.20.51          TLSv1.2  97     Encrypted Alert
    229 6.371162       172.16.20.51          120.24.48.119         TLSv1.2  97     Encrypted Alert
    230 6.377104       172.16.20.51          120.24.48.119         TCP      66     45616 → sgcp(440) [RST, ACK] Seq=532 Ack=2691 Win=96320 Len=0 TSval=20268489 TSecr=3846225914
    231 6.733481       172.16.20.51          120.24.48.119         TCP      74     46870 → sgcp(440) [SYN] Seq=0 Win=65535 Len=0 MSS=1460 SACK_PERM=1 TSval=20268524 TSecr=0 WS=64
    232 6.752156       120.24.48.119         172.16.20.51          TCP      74     sgcp(440) → 46870 [SYN, ACK] Seq=0 Ack=1 Win=28960 Len=0 MSS=1460 SACK_PERM=1 TSval=3846226298 TSecr=20268524 WS=128
    233 6.754694       172.16.20.51          120.24.48.119         TCP      66     46870 → sgcp(440) [ACK] Seq=1 Ack=1 Win=87616 Len=0 TSval=20268527 TSecr=3846226298
    234 6.765797       172.16.20.51          120.24.48.119         TLSv1.2  288    Client Hello
    235 6.784885       120.24.48.119         172.16.20.51          TCP      66     sgcp(440) → 46870 [ACK] Seq=1 Ack=223 Win=30080 Len=0 TSval=3846226330 TSecr=20268527
    236 6.786733       120.24.48.119         172.16.20.51          TLSv1.2  1514   Server Hello, Certificate
    237 6.786736       120.24.48.119         172.16.20.51          TLSv1.2  351    Server Key Exchange, Server Hello Done
    238 6.788554       172.16.20.51          120.24.48.119         TCP      66     46870 → sgcp(440) [ACK] Seq=223 Ack=1449 Win=90496 Len=0 TSval=20268530 TSecr=3846226332
    239 6.790421       172.16.20.51          120.24.48.119         TCP      66     46870 → sgcp(440) [ACK] Seq=223 Ack=1734 Win=93440 Len=0 TSval=20268530 TSecr=3846226332
    240 6.805007       172.16.20.51          120.24.48.119         TLSv1.2  192    Client Key Exchange, Change Cipher Spec, Encrypted Handshake Message
    241 6.824760       120.24.48.119         172.16.20.51          TLSv1.2  117    Change Cipher Spec, Encrypted Handshake Message
    242 6.868162       172.16.20.51          120.24.48.119         TLSv1.2  218    Application Data
    243 6.888374       120.24.48.119         172.16.20.51          TLSv1.2  940    Application Data
    244 6.888378       120.24.48.119         172.16.20.51          TLSv1.2  97     Encrypted Alert
    245 6.895464       172.16.20.51          120.24.48.119         TLSv1.2  97     Encrypted Alert
    246 6.897651       172.16.20.51          120.24.48.119         TCP      66     46870 → sgcp(440) [RST, ACK] Seq=532 Ack=2691 Win=96320 Len=0 TSval=20268541 TSecr=3846226433
    247 7.225247       172.16.20.51          120.24.48.119         TCP      74     36434 → sgcp(440) [SYN] Seq=0 Win=65535 Len=0 MSS=1460 SACK_PERM=1 TSval=20268573 TSecr=0 WS=64
    248 7.240108       120.24.48.119         172.16.20.51          TCP      74     sgcp(440) → 36434 [SYN, ACK] Seq=0 Ack=1 Win=28960 Len=0 MSS=1460 SACK_PERM=1 TSval=3846226790 TSecr=20268573 WS=128
    249 7.244089       172.16.20.51          120.24.48.119         TCP      66     36434 → sgcp(440) [ACK] Seq=1 Ack=1 Win=87616 Len=0 TSval=20268575 TSecr=3846226790
    250 7.260670       172.16.20.51          120.24.48.119         TLSv1.2  288    Client Hello
    251 7.275855       120.24.48.119         172.16.20.51          TCP      66     sgcp(440) → 36434 [ACK] Seq=1 Ack=223 Win=30080 Len=0 TSval=3846226825 TSecr=20268577
    252 7.277743       120.24.48.119         172.16.20.51          TLSv1.2  1514   Server Hello, Certificate
    253 7.277747       120.24.48.119         172.16.20.51          TLSv1.2  351    Server Key Exchange, Server Hello Done
    254 7.280154       172.16.20.51          120.24.48.119         TCP      66     36434 → sgcp(440) [ACK] Seq=223 Ack=1449 Win=90496 Len=0 TSval=20268579 TSecr=3846226827
    255 7.280160       172.16.20.51          120.24.48.119         TCP      66     36434 → sgcp(440) [ACK] Seq=223 Ack=1734 Win=93440 Len=0 TSval=20268579 TSecr=3846226827
    256 7.298557       172.16.20.51          120.24.48.119         TLSv1.2  192    Client Key Exchange, Change Cipher Spec, Encrypted Handshake Message
    257 7.314893       120.24.48.119         172.16.20.51          TLSv1.2  117    Change Cipher Spec, Encrypted Handshake Message
    258 7.327880       172.16.20.51          120.24.48.119         TLSv1.2  218    Application Data
    259 7.344444       120.24.48.119         172.16.20.51          TLSv1.2  940    Application Data
    260 7.344448       120.24.48.119         172.16.20.51          TLSv1.2  97     Encrypted Alert
    261 7.350775       172.16.20.51          120.24.48.119         TLSv1.2  97     Encrypted Alert
    262 7.350788       172.16.20.51          120.24.48.119         TCP      66     36434 → sgcp(440) [RST, ACK] Seq=532 Ack=2691 Win=96320 Len=0 TSval=20268586 TSecr=3846226892
    263 7.689786       172.16.20.51          120.24.48.119         TCP      74     35388 → sgcp(440) [SYN] Seq=0 Win=65535 Len=0 MSS=1460 SACK_PERM=1 TSval=20268620 TSecr=0 WS=64
    264 7.707830       120.24.48.119         172.16.20.51          TCP      74     sgcp(440) → 35388 [SYN, ACK] Seq=0 Ack=1 Win=28960 Len=0 MSS=1460 SACK_PERM=1 TSval=3846227253 TSecr=20268620 WS=128
    265 7.709982       172.16.20.51          120.24.48.119         TCP      66     35388 → sgcp(440) [ACK] Seq=1 Ack=1 Win=87616 Len=0 TSval=20268622 TSecr=3846227253
    266 7.741419       172.16.20.51          120.24.48.119         TLSv1.2  288    Client Hello
    267 7.760187       120.24.48.119         172.16.20.51          TCP      66     sgcp(440) → 35388 [ACK] Seq=1 Ack=223 Win=30080 Len=0 TSval=3846227305 TSecr=20268624
    268 7.762777       120.24.48.119         172.16.20.51          TLSv1.2  1514   Server Hello, Certificate
    269 7.762779       120.24.48.119         172.16.20.51          TLSv1.2  351    Server Key Exchange, Server Hello Done
    270 7.764884       172.16.20.51          120.24.48.119         TCP      66     35388 → sgcp(440) [ACK] Seq=223 Ack=1449 Win=90496 Len=0 TSval=20268627 TSecr=3846227306
    271 7.765011       172.16.20.51          120.24.48.119         TCP      66     35388 → sgcp(440) [ACK] Seq=223 Ack=1734 Win=93440 Len=0 TSval=20268628 TSecr=3846227306
    272 7.805937       172.16.20.51          120.24.48.119         TLSv1.2  192    Client Key Exchange, Change Cipher Spec, Encrypted Handshake Message
    273 7.824954       120.24.48.119         172.16.20.51          TLSv1.2  117    Change Cipher Spec, Encrypted Handshake Message
    274 7.826423       172.16.20.51          120.24.48.119         TCP      66     35388 → sgcp(440) [ACK] Seq=349 Ack=1785 Win=93440 Len=0 TSval=20268634 TSecr=3846227370
    275 7.846173       172.16.20.51          120.24.48.119         TLSv1.2  218    Application Data
    276 7.864865       120.24.48.119         172.16.20.51          TLSv1.2  940    Application Data
    277 7.864871       120.24.48.119         172.16.20.51          TLSv1.2  97     Encrypted Alert
    278 7.870914       172.16.20.51          120.24.48.119         TLSv1.2  97     Encrypted Alert
    279 7.870915       172.16.20.51          120.24.48.119         TCP      66     35388 → sgcp(440) [RST, ACK] Seq=532 Ack=2691 Win=96320 Len=0 TSval=20268638 TSecr=3846227410
    280 8.188631       172.16.20.51          120.24.48.119         TCP      74     39485 → sgcp(440) [SYN] Seq=0 Win=65535 Len=0 MSS=1460 SACK_PERM=1 TSval=20268670 TSecr=0 WS=64
    281 8.203136       120.24.48.119         172.16.20.51          TCP      74     sgcp(440) → 39485 [SYN, ACK] Seq=0 Ack=1 Win=28960 Len=0 MSS=1460 SACK_PERM=1 TSval=3846227753 TSecr=20268670 WS=128
    282 8.204765       172.16.20.51          120.24.48.119         TCP      66     39485 → sgcp(440) [ACK] Seq=1 Ack=1 Win=87616 Len=0 TSval=20268671 TSecr=3846227753
